idx	ATU	SUB	Classifications	Category	Subcategory	Variation Example
1200	1202	-	Hættulega sigðin	Sögur og brandarar (1200-1999)	1200-1349 Fíflasögur	Í landi þar sem notkun sigðarinnar er óþekkt er korn tínt eða skotið niður með byssum. Þegar fólk reynir að nota sigð sker það einn af mönnunum. Fólk heldur að sigðin sé hættulegt dýr og drekkir því sem refsingu.
1201	1203	-	Ljósinn höggur höfuðið af manni	Sögur og brandarar (1200-1999)	1200-1349 Fíflasögur	Höfuðkúpa ber sigð um hálsinn. Þegar hann reynir að taka hana af sér höggvar hann höfuðið af.
1202	1203	A	Sigðin sem talin var vera höggormur	Sögur og brandarar (1200-1999)	1200-1349 Fíflasögur	Höfuðkúpur finna sigð og rugla henni saman við höggorm (orm, dreka, skrímsli). Þeir slá hana og hún hoppar upp og lendir um háls eins þeirra. Þegar þeir toga í „höggorminn“ höggva þeir höfuð mannsins af.
1203	1204	-	Fíflið endurtekur fyrirmæli sín	Sögur og brandarar (1200-1999)	1200-1349 Fíflasögur	Fíflið endurtekur fyrirmæli sín til að muna þau. Hann gleymir þeim yfirleitt.
1204	1204	**	Að mjólka hænu	Sögur og brandarar (1200-1999)	1200-1349 Fíflasögur	Þessi tegund af sögum inniheldur sögur þar sem fífl misskilur eðli húsdýra. Til dæmis reynir (gömul) kona að mjólka hænu eða hún móðgar hana (drepur hana) vegna þess að hún sýgur ekki kjúklingana sína.
1205	1208	*	Bjallaða laxinn	Sögur og brandarar (1200-1999)	1200-1349 Fíflasögur	Bjalla er bundin á lax (ál, gedda) svo hægt sé að finna fiskinn síðar.
1206	1210	-	Kýr er tekin upp á þakið til að beita	Sögur og brandarar (1200-1999)	1200-1349 Fíflasögur	Í sumum afbrigðum er dýrinu ekið upp rampa; í öðrum er því híft upp á þak eða (kirkju-)turn og kyrkt.
1207	1211	-	Kýrin tyggir kúkinn sinn	Sögur og brandarar (1200-1999)	1200-1349 Fíflasögur	Bóndi (þyrsti) drepur kú (geit, uxa) vegna þess að hún heldur að hún sé að herma eftir henni (gefur henni ekki tyggjó). Í sumum afbrigðum er dýr drepið vegna þess að væl þess (mæling eða þess háttar) er misskilið sem hlátur eða háð. Í öðrum afbrigðum telur þorpsbúi að asninn hlusti á það sem hann segir honum, vegna þess að eyrað á honum hreyfist.
1208	1213	-	Gaukurinn	Sögur og brandarar (1200-1999)	1200-1349 Fíflasögur	Fífl reisa girðingu úr limgerðum til að halda gauki. Hann flýgur yfir einn af limgerðunum. Þeir segja að þeir hafi ekki byggt múrana nógu háir. Í sumum afbrigðum ákveður fífl að loka bæjarhliðinu svo að fugl (t.d. fálki, dúfa) sem flaug í burtu geti ekki sloppið.
1209	1214	-	Sannfærandi uppboðshaldarinn	Sögur og brandarar (1200-1999)	1200-1349 Fíflasögur	Uppboðshaldari (sölumaður) hrósar verðlausri kú manns svo mikið að maðurinn tekur hana til baka sjálfur.
1210	1214	*	Að keyra hest í beisli	Sögur og brandarar (1200-1999)	1200-1349 Fíflasögur	Að reka hest í beislið í stað þess að setja hann á hestinn.
1211	1215	-	Myllarinn, sonur hans og asninn	Sögur og brandarar (1200-1999)	1200-1349 Fíflasögur	(Asinus vulgi.) Myllumaður og sonur hans ferðast með einum asna (hesti). Fyrst ríður sonurinn og er ávítaður af vegfaranda fyrir að leyfa föður sínum að ganga. Síðan ríður faðirinn og er gagnrýndur fyrir að láta son sinn ganga. Þegar báðir ríða eða báðir ganga er þeim samt kennt um. Sem lexía sýnir faðirinn syninum að það er erfitt (ómögulegt) að þóknast öllum. Í sumum afbrigðum bera faðirinn og sonurinn asnann (hestinn) á milli sín og kasta honum í vatnið eða drepa hann.
1212	1216	*	Týnda lyfseðilinn	Sögur og brandarar (1200-1999)	1200-1349 Fíflasögur	Það var skrifað með krít á hurðina og skolað burt í rigningunni.
1213	1218	-	Numskull situr á eggjum til að klára útungun	Sögur og brandarar (1200-1999)	1200-1349 Fíflasögur	Þessi saga er aðallega til í þremur mismunandi myndum: (1) Heimskur sonur (heimskur eiginmaður) er einn heima. Meðal annars ber hann ábyrgð á gæs sem er að rugga en klúðrar verkinu: Fuglinn er truflaður og hleypur í burtu (hvítkúpan drepur hana). Þar sem hann er hræddur við móður sína (eiginkonu) sest hann sjálfur á eggin til að klára útungunina (stundum hylur hann sig með hunangi eða tjöru og fjöðrum áður en hann sest á eggin). (2) Þjófur tekur að sér erfiða vinnu við að klekja út eggjum sem hann á að fá vel borgað fyrir. Þegar vinnuveitandinn (t.d. húsfreyjan) spyr um niðurstöðurnar brennir hann hlöðuna með hænunum sem eru að því er virðist útungaðar og lætur eins og þær séu allar dánar. (3) Þjófur fær einhvern til að sitja á eggjum til að setja hann í niðurlægjandi stöðu.
1214	1221	A*	Fiskurinn of stór fyrir pönnuna	Sögur og brandarar (1200-1999)	1200-1349 Fíflasögur	Fífl (þumalfingur) henda fiski (köku) vegna þess að hann er of stór fyrir pönnuna. Eða þeir stytta stiga vegna þess að hann er of langur til að bera á milli trjáa.
1215	1225	-	Maðurinn án höfuðs	Sögur og brandarar (1200-1999)	1200-1349 Fíflasögur	Höfuð ræningja er höggvið af fyrir slysni (bitið af birni, úlfi eða krókódíli á veiðum, rifið af í myllu, kramið af steini, festist í trjágreinum). Félagar hans finna líkið án höfuðs og ræða: Hafði hann einhvern tímann haft höfuð? Þeir muna aðeins eftir skegginu. Kona hans veit að hún prjónaði einu sinni húfu handa honum (að rakarinn kom oft til að raka hann) og því hlýtur hann að hafa haft höfuð.
1216	1225	A	Hvernig komst kýrin upp á stöngina?	Sögur og brandarar (1200-1999)	1200-1349 Fíflasögur	Þessi saga er aðallega til í tveimur mismunandi myndum: (1) Nemandi (oft sonur bónda) kemur heim úr háskólanum í heimsókn. Hann liggur í rúminu og veltir fyrir sér hvernig kúaskítur geti komist upp á þakið. Faðir hans upplýsir hann um að bjálkinn hafi þegar verið óhreinn þegar hann var settur upp. (2) (Að ráði skúrks) felur fífl (fífl) veski ofan á stöng (í hreiðri í háu tré). Skúrkurinn notar þurran kúaskít í staðinn fyrir peningana. Fíflinn hefur aðeins áhuga á því hvernig kýrin gat klifrað upp stöngina.
1217	1227	-	Að veiða íkorninn	Sögur og brandarar (1200-1999)	1200-1349 Fíflasögur	Tveir hauskúpur (karlar eða konur) ætla að veiða íkorna. Annar eltir hann á meðan hinn hleypur heim til að ná í pönnu (pott). Sá fyrsti fellur úr tré (og deyr). Andlit þess fyrsta er þakið blóði eftir fallið og sá seinni heldur að félagi hans hafi étið hráa íkornann og kafnað í honum. Fullur reiði brýtur hann pottinn (á höfðinu á sér).
1218	1228	-	Að skjóta úr byssu	Sögur og brandarar (1200-1999)	1200-1349 Fíflasögur	Þessi saga er aðallega til í þremur mismunandi myndum: (1) Heimskur horfir niður í hlaupið þegar skotið er úr byssu. (2) Tveir heimskingjar rugla byssu saman við flautu. Þeir ákveða að annar muni blása í hana á meðan hinn ýtir á „takkana“. Byssan fer af og skýtur af höfði „flautuleikarans“. (3) Heimskurnar skjóta úr trébyssu sem springur og drepur nokkra þeirra. Þeir fagna því að óvinurinn hafi orðið fyrir enn meira tapi.
1219	1229	-	Ef hali úlfsins brotnar	Sögur og brandarar (1200-1999)	1200-1349 Fíflasögur	Brögðumaður og félagi hans fara á úlfaveiðar (bjarnarveiðar). Annar þeirra smeygir sér inn í úlfshelli. Þegar úlfurinn kemur aftur grípur maðurinn fyrir utan hann í halann. Úlfurinn klórar jörðina svo að ryk kemst í augu félagans. „Hvílíkt ryk.“ – „Ef halinn á úlfnum brotnar, þá sérðu allt aðra tegund af ryki!“. Í sumum afbrigðum spyr brögðumaðurinn í hellinum: „Af hverju er svona dimmt hérna inni?“ – „Ef halinn brotnar, þá veistu það.“
1220	1229	*	Að moka hnetum með hekkgaffli	Sögur og brandarar (1200-1999)	1200-1349 Fíflasögur	Hnífshausar reyna að moka hnetum með heygaffli. Ókunnugur maður sýnir þeim hvernig á að gera þetta verk auðveldara með skóflu (körfu). (Hann fær háa umbun.)
1221	1230	*	Pílagrímsferðarheitið	Sögur og brandarar (1200-1999)	1200-1349 Fíflasögur	Kona í pílagrímsferð fær óvart pilsið sitt (og skyrtuna) úr lagi og ber rassinn afhjúpaður. Eiginmaður hennar segir henni ekkert um þetta því hann telur þetta vera hluta af pílagrímsferðareiði hennar.
1222	1230	**	Ávítur fyrir að fara með bert höfuð	Sögur og brandarar (1200-1999)	1200-1349 Fíflasögur	Kona, sem hefur verið gagnrýnd fyrir að ganga berhöfðuð á götu, hylur það með pilsi sínu og sýnir þannig rassinn.
1223	1231	-	Árásin á kanínuna (krabbi)	Sögur og brandarar (1200-1999)	1200-1349 Fíflasögur	Sjö (níu) menn hyggjast ráðast á hið grimmilega dýr. Einn þeirra öskrar af ótta og dýrið hleypur í burtu.
1224	1238	-	Þakið í góðu og slæmu veðri	Sögur og brandarar (1200-1999)	1200-1349 Fíflasögur	Maður byggir ekki þak á hús sitt (gerir það ekki við): Hann þarf ekki þak þegar veðrið er gott; og hann getur ekki sett það á í rigningu.
1225	1240	-	Að skera af greininni	Sögur og brandarar (1200-1999)	1200-1349 Fíflasögur	Heimskur maður sem situr á grein trés heggur hana af. Í grískri útgáfu klifrar hann með erfiðismunum upp á dauða grein trés sem brotnar af.
1226	1241	-	Tréð á að vera rifið niður	Sögur og brandarar (1200-1999)	1200-1349 Fíflasögur	Fífl (domskulls) vorkenna tré (venjulega víði) sem stendur við tjörn og hengir greinarnar niður eins og það vilji drekka. Þeir rífa það niður til að gefa því vatn. Einn maðurinn stingur höfðinu í greinarnar á meðan hinir toga í fætur hans. Í sumum útgáfum rífa þeir höfuðið af honum, í öðrum falla þeir allir niður.
1227	1241	A	Að draga út tréð	Sögur og brandarar (1200-1999)	1200-1349 Fíflasögur	Fífl og asni hans reyna að toga tré sem stendur á kletti. Tréð fellur og dregur þá niður með sér. Í sumum afbrigðum fella fífl tré þannig að það dettur beint á vagn. Tréð brýtur vagninn og drepur hestinn (uxann).
1228	1242	-	Hleðsla viðar	Sögur og brandarar (1200-1999)	1200-1349 Fíflasögur	Heimskur hleður viðarbita fyrir bita í vagn og segir: „Ef hestarnir (uxarnir) geta dregið þetta, þá geta þeir dregið einn bita í viðbót.“ Þegar hann kemst loksins að því að þeir geta ekki dregið byrðina, kastar hann bita eftir bita og hugsar með sér: „Ef þeir geta ekki dregið þetta, þá geta þeir ekki dregið einn minna.“ Hann ekur heim með tóman vagn. (Í sumum finnskum útgáfum er heimski einstaklingurinn kona).
1229	1242	A	Léttir fyrir asnann	Sögur og brandarar (1200-1999)	1200-1349 Fíflasögur	Í stað þess að setja hveitisekk (einhverja aðra byrði) á bak asna (uxans) setur knapinn hann á öxl sér til að létta byrði dýrsins. Í sumum útfærslum setur maður byrði á aðra hliðina á söðli og jafnar hana hinum megin með steini.
1230	1243	-	Viður er borinn niður hæðina	Sögur og brandarar (1200-1999)	1200-1349 Fíflasögur	Fífl bera þungan trjástofn (myllustein) niður hæð. Á leiðinni sleppa þeir stofninum og hann rúllar það sem eftir er leiðarinnar niður. Þegar þeir taka eftir að verkið er miklu auðveldara á þennan hátt bera þeir stofninn aftur upp hæðina til að rúlla honum niður aftur.
1231	1244	-	Að reyna að teygja geislann	Sögur og brandarar (1200-1999)	1200-1349 Fíflasögur	Fíflum er gefinn of stuttur bjálki (stöng, göngubrú, bekkur). Þeir reyna á ýmsa vegu að teygja bjálkann. Auðvitað tekst þeim það ekki, en í þýskri útgáfu halda þeir að þeir geri það.
1232	1245	-	Sólarljós borið í poka inn í gluggalaust hús	Sögur og brandarar (1200-1999)	1200-1349 Fíflasögur	Fífl safna sólarljósi í poka (körfu, sigti) og reyna að bera það inn í gluggalaust hús. Þegar þessi áætlun tekst ekki rífa fífl smám saman niður húsið til að fá ljós. (Ókunnugur maður sýnir þeim hvernig á að búa til glugga.) Í sumum afbrigðum nota fífl hvítt sauðskinn sem ljósgjafa eða reyna að grípa ljós í músagildru. Á sama hátt bera fífl reyk með sér í sigti.
1233	1246	-	Öxum kastað burt	Sögur og brandarar (1200-1999)	1200-1349 Fíflasögur	Heimskur lætur öxi sína falla. Hinir halda að þetta hafi verið viljandi og kasta sinni á sama stað. Þessum stutta atburði fylgir venjulega annar atburður þar sem fífl reyna að fella tré á mismunandi vegu: (1) Með því að brenna þau: Til að fá eld slær einn fífl höfuð annars svo að sá síðarnefndi sjái neista. (2) Með því að toga þau út: Einn fífl stingur höfðinu í greinarnar, hinir toga og rífa höfuðið af.
1234	1247	-	Maðurinn stingur höfðinu í holuna í myllusteininum	Sögur og brandarar (1200-1999)	1200-1349 Fíflasögur	Fífl vilja velta myllusteini niður hæð. Einn þeirra stingur höfðinu í holuna á myllusteininum til að leiða hann (til að sjá hvert hann rúllar). Hann rúllar í vatn. Höfuð fíflsins er rifið af.
1235	1248	-	Trjástofnar lagðir þvert á sleða	Sögur og brandarar (1200-1999)	1200-1349 Fíflasögur	Fífl vilja flytja viðarstafla (langan trjástofn). Þeir leggja hann þvert á sleða (vagn) og komast ekki út úr skóginum (í gegnum hlið). Þeir finna lausn á vandamáli sínu aðeins þegar þeir sjá fugl ganga fram hjá með stráþráð til hliðar.
1236	1250	-	Mannkynskeðjan	Sögur og brandarar (1200-1999)	1200-1349 Fíflasögur	Fífl vilja mæla dýpt brunns (ná í eitthvað úr vatninu). Þeir leggja trjábol þvert yfir hann. Einn maður heldur á trjábolnum með höndunum, sá næsti klifrar niður og heldur um fæturna, og svo framvegis. Sá efsti verður þreyttur og spýtir í hendurnar. Allir falla ofan í brunninn. Í sumum útgáfum er mannskeðjan smíðuð til að ná upp á topp trés. Í indverskri/srílankskri útgáfu dinglar mannskeðjan (apaketja) frá hala fljúgandi fíls.
1237	1250	A	Karfa hlaðin upp til að mæla turninn	Sögur og brandarar (1200-1999)	1200-1349 Fíflasögur	Fífl setja körfur hverja ofan á aðra til að mæla hæð turns. Sú sem er neðst er fjarlægð og allir falla. Í sumum útgáfum vilja fíflarnir ná í fuglahreiður (dýrabæli) í háu tré. Þeir klifra upp á axlir hvers annars. Þegar fífillinn neðst fellur niður, falla allir hinir líka.
1238	1255	-	Hola til að kasta jörðinni í	Sögur og brandarar (1200-1999)	1200-1349 Fíflasögur	Núllhausinn (Numskull) ætlar að grafa holu til að hafa stað til að henda moldinni úr uppgreftinum sínum.
1239	1260	-	Hafragrautur í ísholunni	Sögur og brandarar (1200-1999)	1200-1349 Fíflasögur	Þessi saga er aðallega til í þremur mismunandi myndum: (1) Hvítlauksmenn setja hveiti (valsaða hafrar) í sjóðandi straum ísholu og stökkva síðan, einn á fætur öðrum, út í til að smakka grautinn. Þeir deyja. (2) Hvítlauksmenn kaupa ketil sem á að sjóða sjálfur. Hann virkar ekki svo þeir kasta honum í vatnið. Þegar ketill sekkur sendir hann upp loftbólur. Í þeirri trú að ketill sé loksins að sjóða stökkva hvítlauksmennirnir í vatnið til að ná í það. (3) Kona setur hveiti í á (sykur í brunn) til að búa til brauðdeig (sítrónusafa). Hún missir allt (og eiginmaður hennar hendir henni út).
