idx	ATU	SUB	Classifications	Category	Subcategory	Variation Example
950	921	F*	Gæsir tíndar	Raunverulegar sögur (850-999)	920-929 Snjallar aðgerðir og orð	Bóndi (handverksmaður) heillar höfðingja með snjöllum spurningum og svörum, sem hirðmenn hans gátu ekki gefið. Höfðinginn lofar að senda bóndanum gæsir (aðra fugla, dýr) til að tína (skera, mjólka, flá). „Gæsirnar“ eru hirðmenn sem, undir hótun um uppsögn (dauða), þurfa að leysa gátur sem bóndinn setur fram. (Höfðinginn segir: „Gæsirnar frá Rússlandi eru að fljúga hingað [aðalsmennirnir]; tínið þær!“) Bóndinn nýtir sér ráðleggingar höfðingjans og tekur mikla peninga frá þeim (fyrir að útskýra svarið við gátunni).
951	922	-	Hirðirinn sem kemur í stað prestsins svarar spurningum konungsins	Raunverulegar sögur (850-999)	920-929 Snjallar aðgerðir og orð	Sá sem hefur háa félagslega stöðu (keisari, konungur, embættismaður, kennari) krefst þess að prestur (biskup, ábóti, prestur, beiðandi) svari þremur erfiðum spurningum innan ákveðins tíma að viðbættum dauðadómi. Presturinn getur ekki svarað spurningunum og sendir því (dulbúinn) fulltrúa (þjón, fjárhirði, myllura, bróður). Þessi maður svarar öllum spurningunum rétt fyrir sig. Þegar blekkingin kemur í ljós fyrirgefur spyrjandinn blekkinguna og umbunar þeim sem svaraði (þyrmir oft lífi yfirmannsins eða bróðurins). Margar spurninganna krefjast þess að mæla (telja) eitthvað sem ekki er hægt að mæla (telja). Með orðaleik (Hversu mikið vegur tunglið? Pund, þar sem það hefur fjóra fjórðunga), með því að setja ómögulegt skilyrði í lok ósannarlegrar fullyrðingar (Hversu mörg lauf eru á trénu? Svo og svo mörg, og ef þú trúir því ekki, teldu þau, eða eins mörg og stilkarnir eru), eða ósannarlegrar samanburðar (Hversu margar stjörnur eru á himninum? Eins margar og sandkorn eru á ströndinni, og ef þú getur talið þau, þá veistu hversu margar stjörnur eru á himninum), o.s.frv., snýr sá sem svarar spurningunni að fáránleika. Spurningarnar eru meðal annars: „Hversu margir vatnsdropar eru í sjónum?“; „Hversu hátt er himinninn?“; „Hversu mörg hár eru á höfði mínu?“; „Hversu margar sekúndur eru í eilífðinni?“; „Hversu langt er annar endi veraldar frá hinum?“; „Hvar er miðja jarðar?“; „Hversu mikið er konungurinn virði?“; „Hver er sætasti söngurinn?“; „Hver er besti fuglinn?“; „Hver er hraðastur, sætasti og dýrasti?“; „Hversu mikið er gullplógur virði?“; „Hvað gerir Guð?“; „Hversu langt er frá gæfu til óheppni?“; „Hvað er ég að hugsa?“
952	922	A	Achiqar	Raunverulegar sögur (850-999)	920-929 Snjallar aðgerðir og orð	Barnlaus ráðherra ættleiðir frænda sinn (Achiqar), elur hann upp og kennir. Hann kynnir fósturson sinn fyrir konunginum, sem kann vel að meta snjöll svör drengsins. Þegar ráðherrann verður gamall mælir hann með fóstursyni sínum sem eftirmanni konungsins. Ungi drengurinn er skipaður í embættið en rægir fósturföður sinn. Konungurinn fyrirskipar að gamla ráðherrann skuli drepinn. Í staðinn er honum bjargað og þræll drepinn í hans stað. Þegar fjandsamlegur konungur fréttir af dauða ráðherrans setur hann konunginum verkefni sem enginn getur sinnt. Hann biður um mann sem getur byggt loftkastala og svarað erfiðum spurningum. Konungurinn leitar örvæntingarfullur að gamla ráðherra sínum. Þegar hann fréttir að hann sé enn á lífi setur hann hann aftur í fyrri stöðu sína. Undir öðru nafni ferðast gamli ráðherrann til hins fjandsamlega konungs. Hann lætur örn bera barn sem situr í körfu upp í loftið, þar sem drengurinn hrópar: „Gefið mér steina og kalk svo ég geti byrjað að byggja höllina!“ Eftir að hafa leyst allar gáturnar sem konungurinn setti honum, snýr hann aftur með ríkulega umbun. Hann biður um að fóstursonur sinn sé kallaður fyrir og refsar honum með grimmum dauða.
953	922	B	Andlit konungsins á myntinni	Raunverulegar sögur (850-999)	920-929 Snjallar aðgerðir og orð	Konungur hittir bónda (smið) og fær dularfull svör við spurningum hans. Þegar bóndinn útskýrir síðar hvað felst í svörum sínum bannar konungurinn honum að afhjúpa lausnirnar nema hann hafi séð hann (andlit sitt) 100 sinnum. Þá gefur hann bóndanum (nokkra) mynt. Þegar konungurinn skýrir ráðgjöfum sínum frá undarlegu samtali sínu við bóndann veit enginn þeirra svarið. Þeir finna spyrjandann sem, eins og honum var sagt, neitar að segja þeim neitt. En hann lætur undan þegar kröfu hans um greiðslu með ákveðnum fjölda mynta með mynd konungsins á er uppfyllt. Þegar konungurinn heyrir lausnina frá ráðgjöfum sínum grunar hann að bóndinn hafi sagt leyndarmálið og ávítar (refsar) hann. En bóndinn er saklaus því hann hafði séð mynd af höfðingjanum 100 sinnum á myntunum. Hann er umbunaður af konunginum (skipar hann ráðgjafa, giftir hann dóttur sinni).
954	923	-	Ást eins og salt	Raunverulegar sögur (850-999)	920-929 Snjallar aðgerðir og orð	Konungur (ríkur maður) spyr þrjár dætur sínar hversu mikið þær elski hann. Þær tvær eldri bera saman ást sína við dýrmæta hluti (gull, gimsteina, sykur, hunang, dýrmæt föt), en sú yngsta segir að hún elski hann eins og salt. Faðirinn móðgast við svar yngstu dóttur sinnar og rekur hana burt (fyrirskipar dauða hennar), en hann umbunar eldri dætrunum í hlutfalli við verðmæti smjaðurs þeirra. Yngsta dóttirin vinnur síðan sem þerna í erlendu landi, en hún giftist síðar konungi þess. Hún býður föður sínum í brúðkaupsveisluna og ber honum fram rétti án salts. Þannig verður faðirinn meðvitaður um ómissandi salt. Dóttirin afhjúpar hver hún er.
955	923	A	Eins og vindur í heitri sólinni	Raunverulegar sögur (850-999)	920-929 Snjallar aðgerðir og orð	Eiginkona segir að hún elski eiginmann sinn eins og vind í brennandi sólinni. Fyrst móðgast hann en síðar, í brennandi sólinni, lærir hann gildi vindsins á heitum degi. Hann skilur merkingu orða eiginkonu sinnar (og snýr aftur til hennar).
956	923	B	Prinsessan sem bar ábyrgð á eigin auðæfum	Raunverulegar sögur (850-999)	920-929 Snjallar aðgerðir og orð	Þegar konungur spyr dætur sínar (þrjár) hver beri ábyrgð á gæfu þeirra (hver hefur blessun ríkisins, auðs og heiðurs), svara eldri dæturnar að hann sé sá eini, en sú yngsta segir að hún sjálf (aðeins Guð) beri ábyrgð (hún fullyrðir að kona beri ábyrgð á gæfu eiginmanns síns). Faðir hennar reiðast yfir fullyrðingu hennar og neyðir hana til að giftast betlara (laumuðum) sem hún verður að búa með í fátæklegum aðstæðum (hún er rekin burt). Sumar útgáfur byrja á lýsingu á prins sem verður lamaður: Prins fylgist með baráttu tveggja snáka og hjálpar þeim veikari og biður hann um að meiða hann ekki. Engu að síður læðist snákurinn í gegnum munn hans inn í líkama hans, afmyndar hann og gerir hann veikan. Prinsinn er rekinn burt af föður sínum og verður betlari. Fyrir tilstilli snilldar konu sinnar (kunnáttu) verður betlarinn ríkur, verður konungur eða læknast af sjúkdómi sínum. Í öðrum útgáfum snýr eiginmaðurinn töfrum sínum aftur til fyrri sjálfsmyndar sinnar sem prins. Faðirinn heimsækir nýja konunginn, þekkir dóttur sína og neyðist til að viðurkenna að hún beri ábyrgð á eigin auðæfum. Eða faðir hennar hefur, á meðan, misst konungsríki sitt og reikar fátækur til hallar dóttur sinnar.
957	924	-	Umræða á táknmáli	Raunverulegar sögur (850-999)	920-929 Snjallar aðgerðir og orð	Tveir menn (konungur og hirðir, prestur og Gyðingur, Rómverji og Grikkir, hermaður og listamaður) eiga samtal (deilu) á táknmáli. Þeir túlka tákn ranglega og misskilja hvor annan; til dæmis: Konungurinn réttir upp annan fingur sem þýðir: „Ég einn er máttugur“. Hirðirinn heldur að konungurinn sé að biðja um eina kind og réttir upp tvo fingur sem þýðir að hann muni gefa konunginum tvo kindur. Konungurinn túlkar fingurna tvo sem þýðingu: „Guð er jafn máttugur og þú“.
958	925	-	Fréttir fyrir konunginn	Raunverulegar sögur (850-999)	920-929 Snjallar aðgerðir og orð	Konungurinn fullyrðir að hver sem segi honum að hestur hans sé dauður skuli deyja. Þjónn segir konunginum frá flugum sem skríða inn í munn hestsins og út þar sem rófan er. Þegar konungurinn hrópar upp yfir sig að hesturinn hans hljóti þá að vera dauður, segir þjónninn við hann: „Þú sagðir það, ekki ég.“
959	925	*	Það fallegasta í garðinum	Raunverulegar sögur (850-999)	920-929 Snjallar aðgerðir og orð	Fátæk kona sendir þrjá syni sína út í heiminn. Þeir koma (einn af öðrum) að garði konungshallarinnar þar sem þeir hitta prinsessuna. Hún spyr hvern og einn þeirra hvað sé fallegast í garðinum (hvað honum líkar best). Sá yngsti svarar: „Þú sjálfur“. Þá giftist prinsessan honum.
