idx	ATU	SUB	Classifications	Category	Subcategory	Variation Example
520	506	*	Spádómur slapp undan	Galdrasögur (300-749)	500-559 Yfirnáttúrulegir hjálparar	Barn fæðist sem svar við bæn. Því er fyrirséð að það muni deyja með hengingu þegar það verður 20 ára gamalt. Barnið fær hjálp frá félaga (dýrlingi) sem hefur hylli þess vegna hógværðar sinnar. Félaginn bjargar lífi barnsins og vinnur því prinsessu. Hjálparinn krefst helmings vinningsins, þannig að prinsessan á að skiptast.
521	507	-	Brúður skrímslisins	Galdrasögur (300-749)	500-559 Yfirnáttúrulegir hjálparar	Þessi tegund samanstendur af einum inngangshluta og tveimur mismunandi aðalhlutum. Endirinn er oft sá sami. Inngangur: Á ferðalagi sér ungur maður um viðeigandi útför fyrir óþekktan mann sem kröfuhafar fóru illa með líkið. Síðar hittir hann ferðafélaga (þjón) sem vill hjálpa honum gegn því skilyrði að þeir skipti öllum vinningum sínum. Á leiðinni fær ferðafélaginn (þrjá) töfrahluti (t.d. stígvél, töfrahettu, skikkju, sverð, fjöður). Ungi maðurinn heillar prinsessu sem er ástfangin af töframanni (trölli, djöfli). Biðlarar hennar þurfa að giska á hugsanir hennar þrisvar sinnum (koma með falda hluti, leysa erfið verkefni). Ef þeim mistekst eru þeir teknir af lífi. Aðalhluti: (1) Með hjálp töfrahlutanna verður félagi unga mannsins ósýnilegur og fylgir prinsessunni á leið hennar til töframannsins. Þar finnur hann lausnirnar. Hann frelsar prinsessuna með því að berja, brenna eða drepa töframanninn. Á brúðkaupsnóttinni þarf ungi maðurinn að sökkva prinsessunni (í mismunandi myndum) þrisvar sinnum í bað til að leysa hana frá töfrum sínum. (2) Allir brúðgumar prinsessu hafa farist á brúðkaupsnóttinni. Ungi maðurinn giftist henni að ráði förunautar síns. Snákur (snákar) kemur inn í herbergið eða skríður út úr munni prinsessunnar til að drepa unga manninn, en förunauturinn drepur hann. Endir: (Eftir eitt ár) krefst förunauturinn helmings vinningsins og skiptir prinsessunni í tvo hluta. Snákar skríða út úr líkama hennar. Hann setur helmingana saman og prinsessan verður fyrir vonbrigðum að eilífu. Í nokkrum afbrigðum þykist förunauturinn aðeins skipta prinsessunni til að prófa trú unga mannsins og afhjúpar síðan hver hann er þakklátur látinn maður.
522	510	-	Öskubusku og Peau d'Anne	Galdrasögur (300-749)	500-559 Yfirnáttúrulegir hjálparar	Þessi tegundarnúmer vísar til hringrásar af skyldum sögum
523	510	A	Öskubusku	Galdrasögur (300-749)	500-559 Yfirnáttúrulegir hjálparar	(Cenerentola, Cendrillon, Aschenputtel.) Ung kona verður fyrir illri meðferð af stjúpmóður sinni og stjúpsystrum og þarf að lifa í öskunni sem þjónustustúlka. Þegar systurnar og stjúpmóðirin fara á ball (kirkju) gefa þær Öskubusku ómögulegt verkefni (t.d. að flokka baunir úr ösku), sem hún klárar með hjálp fugla. Hún fær falleg föt frá yfirnáttúrulegri veru eða tré sem vex á gröf látinnar móður hennar og fer óþekkt á ballið. Prins verður ástfanginn af henni en hún þarf að fara snemma af ballinu. Hið sama gerist næsta kvöld en þriðja kvöldið týnir hún einum af skónum sínum. Prinsinn giftist aðeins þeirri konu sem skórinn passar. Stjúpsysturnar skera bita af fótum þeirra til að láta þá passa í skóinn en fugl vekur athygli á þessum blekkingum. Öskubuska, sem hafði fyrst verið falin fyrir prinsinum, mátar skóinn og hann passar henni. Prinsinn giftist henni.
524	510	B	Peau d'Asne	Galdrasögur (300-749)	500-559 Yfirnáttúrulegir hjálparar	(Húfa af ási, asnaskinn, alls kyns feldur, allerleirauh.) Konungur lofar konu sinni á dánarbeði hennar að giftast annarri konu sem er jafn falleg og hún (sem sérstakur hringur passar við). Þar sem hún er sú eina sem uppfyllir þetta skilyrði vill konungurinn giftast fullorðinni dóttur sinni. Til að fresta brúðkaupinu biður unga konan hann að gefa henni kjóla eins og sólina (gull), tunglið (silfur) og stjörnur (demöntum) og frakka úr mörgum mismunandi gerðum af feldi (viðarklæðningu). Eftir að hann hefur útvegað allt þetta flýr dóttirin frá föður sínum og, dulbúin í ljótu skinninu, vinnur hún sem eldhúsþerna (gæsastúlka) í annarri kastala. Þegar röð veislna er haldin í kastalanum þar sem hún vinnur, klæðist unga konan leynilega í glæsilega kjóla hennar. Prinsinn verður ástfanginn af henni en þekkir hana ekki sem eldhúsþernan. Dagana eftir kemur hann illa fram við eldhúsþernan. Á veislunum spyr hann hina fögru konu hvaðan hún komi og hún gefur dularfull svör sem vísa til þess hvernig hann hefði komið fram við eldhússtúlkuna. Hann gefur henni hring. Þá verður prinsinn ástfanginn. Í hlutverki eldhússtúlkunnar rennir hún hringnum hans í súpu hans (brauð). Hann finnur hana og giftist henni. Stundum er unga konan uppgötvuð þegar hún er að baða sig eða klæða sig í stað þess að vera þekkt með tákni.
525	510	B*	Prinsessan í kistunni	Galdrasögur (300-749)	500-559 Yfirnáttúrulegir hjálparar	Ekkjakonungur vill giftast dóttur sinni. Hún krefst þess að hann gefi henni töfra gullkistu (gullljós). Á brúðkaupsdegi þeirra felur hún sig í kistunni. Faðirinn selur kistuna prinsi (henni er kastað í sjóinn, þar sem prins finnur hana og færir hana inn í hús sitt). Þegar prinsessan kemur leynilega út og borðar mat hans, uppgötvar hann hana og verður ástfanginn af henni. Unnusta prinsins uppgötvar prinsessuna og sendir hana burt. Prinsinn verður ástfanginn og prinsessan færir honum mat þar sem hún hefur falið hring prinsins. Hann finnur hana og giftist henni.
526	511	-	Eitt auga, tvö augu og þrjú augu	Galdrasögur (300-749)	500-559 Yfirnáttúrulegir hjálparar	Stelpa (drengur) á stjúpmóður sem gefur henni ekki nóg að borða heldur lætur hana smala nautgripum og spinna mikið magn af hör. Hún segir frá sorgum sínum við (litla litaða) kú (rauðuxa, guðmóður), sem gefur henni mat og hjálpar henni við vinnuna. Stjúpmóðirin vill vita hvers vegna stelpan er svona vel fóðruð og sendir ein-, tví- og þríeygða dætur sínar, eina á eftir annarri, til að komast að því. Stelpan syngur Ein- og tvíeygða dætur sínar til að sofa, svo þær læra ekkert, en hún gleymir að syngja fyrir þriðja auga Þrí-augna, sem segir móður sinni frá kúnum. Stjúpmóðirin ákveður að láta slátra kúnum. Þegar stelpan segir dýrinu þetta, segir kýrin henni að planta beinum þess (í eistum, eða að borða ekki kjötið af því). Hún gerir eins og henni var sagt og tré (eplatré) vex sem heldur áfram að hjálpa henni. Ríkur maður tekur eftir trénu og biður um epli. Þegar stjúpsysturnar reyna að tína eitt, klórar grein þær. Aðeins stúlkan sjálf getur tínt ávextina og ríki maðurinn giftist henni. Oft fer tréð með þeim. Stjúpmóðirin og stjúpsysturnar eru refsað. Stundum hlaupa barnið og kýrin í burtu þegar stjúpsystirin uppgötvar leyndarmál þeirra. Þær fara um messingar-, silfur- og gullskóga. Í hverjum skógi varar kýrin barnið við að tína laufin, en barnið óhlýðnast. Messinguxi o.s.frv. (úlfur, ljón) kemur og berst við kú barnsins. Sá síðasti sigrar kúna, sem áður en hún deyr segir barninu að bjarga (gróðursetja) einhverjum líkamshluta sínum (horni, hófi, skinni) því það muni hjálpa því síðar. (511A.) Eða kýrin deyr eftir flóttann og breytist í engil sem flýgur til himins. (511A*.) Í sumum afbrigðum vill önnur kona giftast föður stúlkunnar. Hún lofar að annast stúlkuna vel og sannfærir hana um að drepa móður sína með því að láta hana líta í kistu og fella lokið á hálsinn á henni. Í öðrum útgáfum, eftir að stjúpmóðirin uppgötvar leyndarmál kýrinnar, reynir hún að drepa stúlkuna í lokuðum gryfju fullri af logandi glóðum. Hundur varar stúlkuna við fyrir framan gryfjuna. Stjúpmóðirin drepur hundinn og daginn eftir fellur stúlkan í gryfjuna. Hún brennur upp, kýrin sleikir öskuna og önd kemur upp úr. Þegar bróðir hennar kemur heim segir stúlkan í formi þessarar andar honum hvað gerðist. Hann refsar stjúpmóðurinni.
527	513	-	Hinir óvenjulegu félagar	Galdrasögur (300-749)	500-559 Yfirnáttúrulegir hjálparar	Þessi tegundarnúmer vísar til hringrásar skyldra sagna.
528	513	A	Sex fara í gegnum allan heiminn	Galdrasögur (300-749)	500-559 Yfirnáttúrulegir hjálparar	Hermaður sem er leystur úr starfi (fífl) eignast marga (sex) ferðafélaga með einstaka hæfileika: t.d. einn sem hleypur hratt, einn sem borðar mikið magn, einn sem þolir mikinn frost, einn sem getur skotið og hitt vinstra auga flugu úr fjarlægð, einn með skarpa heyrn, einn sem getur gert sig hærri og einn sem getur rifið upp tré með rótum. Til að hefna sín á konunginum sem leysti hann úr starfi tekur hermaðurinn þátt í keppni um að giftast prinsessunni. Hún hefur samþykkt að giftast hverjum þeim sem sigrar hana í hlaupum. Konungurinn leyfir hermanninum að ráða aðstoðarmenn sína. Hlauparinn nær prinsessunni en sofnar og vaknar rétt í tæka tíð af skarpskyttunni. Í tilraun til að koma í veg fyrir brúðkaupið úthlutar konungurinn öðrum verkefnum: að borða (drekka) gríðarlegt magn, sem átarinn nær, og að vera í ofni, sem maðurinn sem frystir nær. Að lokum býður konungurinn hermanninum eins mikla peninga og hann og félagar hans geta borið ef hann gefur upp kröfu sína um prinsessuna. Félagarnir eyðileggja konunginn og sigra her hans. Sömu myndefnin birtast saman í smækkaðri mynd. Prins (ungur maður) leitar sér að konu. Hann tekur sér að þjóna menn sem hjálpa honum að klára verkefni sem hafa verið sett fyrir biðla sem vonast til að giftast prinsessunni. Að lokum giftist hann henni.
529	513	B	Land- og vatnsskip	Galdrasögur (300-749)	500-559 Yfirnáttúrulegir hjálparar	Konungur býður dóttur sína að hjónaband hverjum þeim sem getur smíðað skip sem getur siglt bæði á landi og vatni. Þrír bræður reyna þetta verkefni, en þeir tveir eldri eru óvingjarnlegir við gamlan mann (lítinn mann) sem spyr hvað þeir vilji gera. Sá þriðji sem svarar heiðarlega fær hjálp frá gamla manninum og getur síðan smíðað skipið (á einni nóttu). Gamli maðurinn segir honum einnig að taka með sér alla sem hann hittir. Þetta reynast vera menn með óvenjulega hæfileika. Þegar ungi maðurinn kemur með skipið verður konungurinn undrandi, en þar sem ungi maðurinn er af auðmjúkum uppruna gefur hann honum frekari (erfið) verkefni til að koma í veg fyrir hjónabandið. Ungi maðurinn klárar þau öll með hjálp félaga sinna og giftist prinsessunni.
530	514	-	Kynlífsbreytingin	Galdrasögur (300-749)	500-559 Yfirnáttúrulegir hjálparar	Konungur sem á aðeins (þrjár) dætur verður að senda son í stríð (þarfnast sonar af öðrum ástæðum). Dæturnar biðja um að fá að þykjast vera karlar, en aðeins sú yngsta stenst próf sem faðir hennar setur. Hann gefur henni töfrahluti (hest) og hún fer í stríðið. Í sumum afbrigðum á drottning aðeins dætur og, hrædd við reiði eiginmanns síns, þykist hún vera drengur. Eða af öðrum ástæðum dulbýr kona sig sem karlmann og fer út í heiminn. Konan í karlmannsklæðum vinnur hetjudáðir og/eða fer í þjónustu konungs. Dóttir (systir) konungsins verður ástfangin af henni og vill giftast henni. Konan í karlmannsklæðum neitar, eða hjónabandið er ófullnægjandi. Til að losna við „þjóninn/eiginmanninn“ eru ómöguleg verkefni sett. Konan getur framkvæmt þau með hjálp hjálpar (nokkra hjálpara, hestsins). Í sumum afbrigðum varða prófin kyn „þjónsins“, sem hafði verið dregið í efa. Til dæmis er matarvenjur hennar og hegðun í garði reynd, eða hún er beðin um að baða sig með bræðrum prinsessunnar. Í lok sögunnar breytist konan í karlmannsklæðum í karlmann. Þetta gerist annað hvort með bölvun djöfulsins eða hjálp dýrlings, sjaldan fyrir slysni. Þá er prinsessan hamingjusöm með eiginmanni sínum og fyrri konan verður konungur. Foreldrar hennar eru ánægðir með að þau eigi loksins alvöru son.
531	514	**	Ung kona dulbúin sem maður er freistuð af drottningunni	Galdrasögur (300-749)	500-559 Yfirnáttúrulegir hjálparar	Ung kona í karlmannsklæðum vinnur sem læknir (sendiboði) fyrir konung. Konungskona verður ástfangin af lækninum en fær frásögn (sakar hann um að reyna að tæla hana eða nauðga henni). Reið setur hún ómögulegt verkefni fyrir sig, sem læknirinn verður að framkvæma undir dauðadómi. Oft er það gert til að gera heimskum manni kleift að tala. Heimski maðurinn afhjúpar fyrirætlanir drottningarinnar, sem er tekin af lífi. Konungurinn giftist ungu konunni sem hafði þóttst vera læknir.
532	515	-	Hirðisdrengurinn	Galdrasögur (300-749)	500-559 Yfirnáttúrulegir hjálparar	Barn sem er að finna og hirðir dýr finnur þrjá hluti (úr gleri) sem hann gefur eigendum þeirra til baka. Þeir lofa að umbuna honum. Með hjálp síðasta eigandans, risa, klárar drengurinn þrjú verkefni. Hann eignast kastala þar sem prinsessa er lokuð. Hann bjargar henni og giftist henni.
533	516	-	Trúi Jóhannes	Galdrasögur (300-749)	500-559 Yfirnáttúrulegir hjálparar	Prins vill giftast fallegri prinsessu frá fjarlægu landi vegna þess að hann heyrði nafn hennar, sá mynd af henni eða sá hana í draumi. Trúr þjónn (kjörbróðir, látinn maður sem hann hefur endurleyst) hjálpar honum í þessari leit. Þjónninn þykist vera kaupmaður og felur prinsessuna í skipi, eða hann fer inn í herbergi hennar með því að fela sig í styttu af dýri (á töfrandi hátt). Prinsessan er rænt eða fer sjálfviljug. Á leiðinni til baka heyrir hjálparinn verur (fugla) spá fyrir um framtíðina. Þeir segja að hægt sé að afstýra ákveðnum hættum sem ógna brúðhjónunum með ákveðnum aðgerðum, en einnig að hver sem afhjúpar þetta verði að steini. Hætturnar eru hestur (annað dýr) sem mun hlaupa í burtu með (drepa) brúðgumann, eitraður matur (drykk, föt) og dreki sem mun drepa brúðgumann á brúðkaupsnótt hans. Þegar hjálparinn grípur til aðgerða til að afstýra hættunum virðast gjörðir hans óhóflegar og órökréttar. Þegar hann drepur drekann falla blóðdropar hans á brjóst brúðarinnar. Hann fjarlægir þá (með munninum eða sýgur þá úr líkama hennar á meðan hún er meðvitundarlaus). Prinsinn túlkar þetta sem kynferðislega árás og dæmir hjálparann til dauða. Áður en dómnum er fullnægt réttlætir hann sig og verður að steini skref fyrir skref. Prinsinn og eiginkona hans syrgja hjálparann. Prinsinn uppgötvar (í draumi) að hann getur vakið vin sinn til lífsins með því að fórna eigin börnum. Hann drepur (særir) þau og nuddar steinmanninn með... blóð þeirra. Hjálparinn er vakinn til lífs og hann endurlífgar börnin.
534	516	C	Vinur og Amelius	Galdrasögur (300-749)	500-559 Yfirnáttúrulegir hjálparar	Tveir vinir sem líta nákvæmlega eins út aðstoða hvor annan í neyð. Þegar annar þeirra, sem eldri maðurinn kallar Amelius, er skoraður í sverðbardaga tekur hinn, Amicus, sem er betri sverðmaður, við af honum. Amelius verður eftir hjá konu Amicusar og setur sverð í miðja hjónarúmið á nóttunni. Amicus vinnur bardagann fyrir vin sinn. Síðar fær Amicus holdsveiki. Engill segir þeim að hann muni læknast ef hann baðar sig í blóði barna Ameliusar. Amelius höggur höfuð þeirra af til að bjarga vini sínum. Börnin eru reist til lífs. Eða, vegna þess að móðir hans hafði gefið heit fyrir fæðingu hans, fer ungur maður í pílagrímsferð. Hann hittir vin í gegnum eplapróf: sannur vinur er sá sem, þegar hann deilir epli, tekur minni helminginn (sem tekur eftir að epli vantar). Þegar vinurinn er drepinn (mjög veikur) og aðeins er hægt að lækna hann með blóði barna unga mannsins, fórnar hann börnum sínum til að bjarga vini sínum. Börnin eru síðar reist til lífs.
535	517	-	Drengurinn sem skilur tungumál fuglanna	Galdrasögur (300-749)	500-559 Yfirnáttúrulegir hjálparar	Faðir drengs sem skilur (hefur lært) tungumál fuglanna er spurður af honum að segja frá því sem hann hefur heyrt. Hann er fyrst tregur til þess en endurtekur síðan spádóm fuglanna um að faðirinn muni auðmýkja sig fyrir syninum (mun þjóna honum, færa honum vatn til að þvo sér um hendurnar). Faðirinn ýtir syninum í sjóinn (rekur hann burt, reynir að drepa hann). Sonurinn er bjargaður og fer í þjónustu erlends stjórnanda. Með því að heyra hvað fuglarnir segja frelsar hann þennan stjórnanda frá hröfnum sem pirra hann. Sonurinn er heiðraður og honum er gefið hálft ríkið og hann giftist prinsessu. Í nýju háu stöðu sinni fer hann aftur til foreldra sinna, sem þjóna honum án þess að þekkja hann.
536	518	-	Karlar berjast um töfrahluti	Galdrasögur (300-749)	500-559 Yfirnáttúrulegir hjálparar	(Ungur) maður á ferðalagi hittir þrjá (tvo) menn (risa, djöfla) sem eru að rífast um skiptingu þriggja töfrahluta (t.d. ósýnileikamöttuls, sjömílna stígvéla, óskahattar, fljúgandi teppis) (sem þeir hafa erft). Maðurinn lofar að fella dóm en biður fyrst um að fá að prófa hlutina (til að keppa við eigendurna). Hann tekur töfrahlutina og hleypur á brott með þá. Hann notar þá síðar til að klára erfið verkefni.
537	519	-	Sterka konan sem brúður (Brunhilde)	Galdrasögur (300-749)	500-559 Yfirnáttúrulegir hjálparar	Prins verður ástfanginn af öflugri ungri konu sem giftist aðeins einhverjum sem hefur jafn sterkan mátt og hennar. Þeir sem reyna og mistakast eru teknir af lífi. Þótt hann sé varaður við því leggur prinsinn af stað með sterkum félaga til að vinna hana. Þegar þeir koma á staðinn ræðst hjálparinn á varnarvirki konunnar, drepur her hennar og sigrar konuna sjálfa fyrir hönd húsbónda síns. Hann sigrar hana í einvígi (með því að nota ósýnileikamúr): til dæmis í skotbardaga með risastórum boga, með því að brjóta villta hest hennar. Á brúðkaupsnóttinni reynir sterka konan að kremja prinsinn. Hjálparinn tekur leynilega sæti húsbónda síns og ber hana í þrjár nætur með svipum úr þremur gerðum málms. Þegar konan uppgötvar eftirlíkinguna skipar hún að höggva fætur hjálparans af og sendir prinsinn í svínastíu. Hjálparinn finnur blindan félaga og saman neyða þau illan anda til að lækna þá með lífsins vatni. Hjálparinn snýr aftur, sigrar (drepur) sterku konuna og bjargar prinsinum.
538	530	-	Prinsessa á Glerfjallinu	Galdrasögur (300-749)	500-559 Yfirnáttúrulegir hjálparar	Frásögn í þremur hlutum með nokkrum mismunandi formum og samsetningum: (1) Að nóttu til er akur (heystakkur, garður) í eigu þriggja sona fjölskyldu rændur (eyðilagður). Synirnir halda vörð. Eldri tveir sofna (hlaupa í burtu af ótta), en sá yngsti (með hjálp músar, frosks, gamals manns) heldur sér vakandi og fangar þrjá töfrahesta. Þeir lofa að hjálpa honum í framtíðinni og hann sleppir þeim. Eða, felur sig í heyhaug og er borinn heim af risa. Hann drepur risann og finnur fjársjóð sinn (hjálpræðishauga) og þrjá hesta. Í sumum útgáfum skipar deyjandi faðir sonum sínum að gæta gröfar sinnar. Af sinnuleysi (ótta) skilja eldri bræðurnir þetta verkefni eftir hjá þeim yngsta. Við gröfina fær hann þrjá hesta, sem og pípu (staf, beisli) til að nota til að kalla á þá. (2) Konungsdóttirin er boðin í hjónaband hverjum þeim sem getur riðið upp á fjallstind (úr gleri, kristal, marmara) og/eða tekið gullepli af tindinum. Eða hann verður að kyssa prinsessuna efst og taka hringinn hennar eða trefilinn. Í sumum útgáfum verður hann að stökkva upp að prinsessunni sem situr við gluggann á fjórðu hæð húss (og taka hringinn hennar), eða stökkva yfir gröf. Ungi maðurinn dulbýr sig og tekst það þrisvar sinnum með hjálp töfrahestanna. Í þriðja skiptið gefur konungurinn (prinsessan) honum tákn (merkir hann, hann er slasaður). Hann fer í burtu. (3) Sendiboðar (konungur, prinsessa) leita að meistaranum og/eða öllum mönnunum er skipað að ganga fram hjá prinsessunni (prinsessan kallar alla mennina til veislu). Með tákni sínu (merki, meiðsli) er ungi maðurinn uppgötvaður heima (í húsi konungsins). Hann giftist prinsessunni. Í sumum útgáfum eru hestarnir vonsviknir og verða prinsar (prinsessur).
539	530	A	Svínið með gullnu burstunum	Galdrasögur (300-749)	500-559 Yfirnáttúrulegir hjálparar	Konungur skipar (þremur) tengdasonum sínum að fá sér töfradýr: svín með gullnum burstum, gullhornað hjört, villisvín úr sjónum o.s.frv. Heimskasti sonurinn (annar heimskur drengur) fær þessi undur en skiptir þeim við bræðra sína í skiptum fyrir afskorna fingur og skinn af baki þeirra. Á veislunni þar sem bræðurnir eru heiðraðir eru þeir afhjúpaðir sem svindlarar með sönnunargögnum sem fífillinn sýnir fram á.
540	531	-	Snjalli hesturinn	Galdrasögur (300-749)	500-559 Yfirnáttúrulegir hjálparar	Þessi tegund sögu inniheldur ýmsar sögur sem fjalla um snjallan hest. Sagan er aðallega til í þremur mismunandi myndum, „Guðbarn konungsins og ótrúi félaginn“, „Gullhærða meyjan“ og „Snjalla hesturinn“. Fátækur drengur fer að leita að guðföður sínum, konunginum (Guði, Maríu mey o.s.frv.). Á leiðinni fær hann snjallan töfrahest sem býðst til að hjálpa honum. Gegn ráðleggingum hestsins tekur hann upp glitrandi fjöður (gullhár, gullhestiskór, annan bjartan hlut) sem hann gefur síðar konunginum. Á leiðinni er drengnum fylgt félagi (djöfull, skegglaus maður, sígauni o.s.frv.) sem neyðir hann til að skipta um sæti og sverja þögn. Við hirð konungsins er drengurinn ráðinn sem brúðgumi. Hann hjálpar mismunandi dýrum, sem lofa í staðinn að hjálpa honum. Sviksamur starfsmaður konungsins (félagi drengsins) rægir hann við konunginn og segir að hann hafi státað sig af því að geta fundið fuglinn sem hafði misst fjöðrina og/eða fært gullhærðu meyina (prinsessuna) sem brúði fyrir konunginn. Undir dauðaviðurlögum er honum falið að framkvæma hættulegu verkefnin. Honum tekst það með hjálp hests síns. Hin rænda prinsessa neitar að giftast gamla konunginum fyrr en hún fær ákveðna hluti (kastala sinn, lykla sem hafa fallið í sjóinn, lífsins vatn, o.s.frv.). Drengurinn færir þetta með hjálp hests síns og hjálparmanna sem hann hafði hitt á leið sinni (þakklát dýr). Sem síðasta skilyrði fyrir hjónabandinu krefst prinsessan þess að drengurinn verði drepinn (brenndur, hálshöggvinn, sundurlimaður, með því að baða sig í sjóðandi mjólk eða olíu úr hjörð villtra hryssa, með dauðans vatni, o.s.frv.). Hesturinn bjargar drengnum eða prinsessan endurlífgar hann, yngir hann upp og fegrar hann. Konungnum er gert hið sama með banvænum afleiðingum (prinsessan endurlífgar hann ekki, hann deyr í mjólkinni, o.s.frv.). Töfrahesturinn breytist í unga konu (karl). Drengurinn giftist henni (prinsessunni) og verður konungur.
541	532	*	Töfrauxinn	Galdrasögur (300-749)	500-559 Yfirnáttúrulegir hjálparar	Með hjálp (tveggja, nokkurra) töfrauxa (kúa) plægir drengur kopar- (járn-, stein-) akur konungsins. Hann giftist prinsessunni og fær (helminginn af) ríkinu.
542	533	-	Talandi hesthaus	Galdrasögur (300-749)	500-559 Yfirnáttúrulegir hjálparar	Prinsessa er send til unnusta síns, prins frá framandi landi. Móðir hennar skipar ambátt að fylgja henni og gefur henni lítinn klút með nokkrum dropum af blóði móður sinnar til að vernda hana og sendir talandi hest til að annast hana. Þegar prinsessan missir sjarma móður sinnar á ferðalaginu nær þjónustustúlkan stjórn á prinsessunni, neyðir hana til að skipta um föt og hlutverk og sverja leyndareið. Prinsinn giftist óafvitandi ambáttinni og hin raunverulega prinsessa er ráðin sem gæsastúlka. Þegar falskonan skipar að hesturinn sé drepinn sannfærir prinsessan bónda sinn um að hengja hesthöfuðið á vegginn við hlið þar sem hún gengur daglega. Á hverjum degi heilsar hún hesthöfuðinu með formúlu og hún svarar með því að iðrast meiðsla sem henni er valdið. Þegar hún segir töfraformúlu til að láta hatt gæsastráks fljúga burt (til að halda óþægilegum gæsastrák frá henni), kvartar hann við konunginn. Þá byrjar gamli konungurinn að fylgjast með henni og lætur hana að lokum segja lífssögu sína við ofn (hundinn sinn). Sannleikurinn kemur í ljós, hin raunverulega brúður giftist prinsinum og ambáttin er refsað (hún lýsir óafvitandi yfir eigin dómgreind).
543	535	-	Drengurinn sem tígrisdýr/dýr ættleiddu	Galdrasögur (300-749)	500-559 Yfirnáttúrulegir hjálparar	Drengur er yfirgefinn í skóginum og ættleiddur af villidýrum (tígrisdýrum). Hann fær töfraboga og töfraör (öxi). Dýrin skipuleggja hjónaband fyrir hann. Api (rakari) tekur við af honum. Drengurinn fer að búa hjá gamalli ekkju sem á yndislega dóttur. Hann sannar sjálfsmynd sína með því að nota töfrahluti sína. Hann giftist bæði stúlkunni sem hann var trúlofaður og dóttur ekkjunnar.
