idx	ATU	SUB	Classifications	Category	Subcategory	Variation Example
1280	1291	B	Að fylla sprungurnar með smjöri	Sögur og brandarar (1200-1999)	1200-1349 Fíflasögur	Heimsk kona (karl) sér sprungur í jörðinni (húsveggnum) og þykir vænt um þær. Hún smyr þær með smjörinu sem hún tekur með sér heim (á markaðinn).
1281	1291	D	Aðrir hlutir eða dýr send til að fara sjálf	Sögur og brandarar (1200-1999)	1200-1349 Fíflasögur	t.d. matur (baunir, hveiti) eða dýr (asni, kýr, svín, geit, héri). Í vinsælustu útgáfunni er kanína send til að greiða leiguna. Heimsku bændurnir hengja á hann veski með peningum og gefa honum oft þjórfé að auki.
1282	1292	*	Siðareglur gesta	Sögur og brandarar (1200-1999)	1200-1349 Fíflasögur	Gift dóttir sem heimsækir móður sína mun ekki koma í veg fyrir að svín róti í garðinum þar sem hún er gestur í húsinu. Í sumum afbrigðum segir ung eiginkona, sem hefur verið sagt hvernig hún á að haga sér „sæmilega“, „herra“ við hundinn bæði og við afann.
1283	1293	-	Langt piss	Sögur og brandarar (1200-1999)	1200-1349 Fíflasögur	Drukkinn maður sem er að pissa úti misskilur hljóðið af rennandi læk (ja, fallandi rigningu) og heldur að hann sé ekki búinn. Hann stendur þarna í marga klukkutíma (meira en sólarhring).
1284	1293	*	Að læra að synda	Sögur og brandarar (1200-1999)	1200-1349 Fíflasögur	Heimskur maður drukknar næstum því þegar hann syndir. Hann sver að fara aldrei aftur í vatnið nema hann hafi þegar lært að synda.
1285	1293	A*	Kona brýtur alla diska sína	Sögur og brandarar (1200-1999)	1200-1349 Fíflasögur	Heimsk kona kaupir nokkra leirpotta (diska). Hún setur pottana upp á girðingu. Þegar þeir neita að rýma fyrir síðasta pottinum brýtur hún þá alla. (Þegar konan hefur ekki nægilegt pláss í eldhúsinu sínu negldi hún leirtauið upp á vegginn.)
1286	1293	B*	Höfuð í vatnið	Sögur og brandarar (1200-1999)	1200-1349 Fíflasögur	Maður sem er bundinn við fljótandi trjábol veltir sér við svo að höfuðið er í vatninu og hann er næstum drukknaður. Félagar hans á ströndinni segja: „Hann er ekki enn kominn yfir vatnið og er þegar farinn að þurrka sér um fæturna.“
1287	1293	C*	Ranga hurðin	Sögur og brandarar (1200-1999)	1200-1349 Fíflasögur	Um nóttina pissar maður úti um dyr (vill vita hvernig veðrið er). Einhver inni spyr hann hvernig veðrið sé. Hann svarar: „Himinninn er skýjaður og það lyktar eins og brauð (það eru engar stjörnur)“. Hann hafði óvart opnað dyrnar að matarskápnum (kjallaranum).
1288	1294	-	Að ná kálfshöfuðinu úr pottinum	Sögur og brandarar (1200-1999)	1200-1349 Fíflasögur	Kálfur (úlfaldi, uxi, sauður, hundur) festist í potti (krukku). Að ráði heimskingja er höfuð kálfsins höggvið af og síðan er potturinn brotinn til að ná höfðinu út.
1289	1294	A*	Barn með höfuð fast í krukku	Sögur og brandarar (1200-1999)	1200-1349 Fíflasögur	Barn (kona) festist í krukku (gleri). Heimskur maður ráðleggur að höfuð barnsins sé höggvið af, en fólk kýs frekar að brjóta krukkuna. Í sumum afbrigðum þarf að brjóta krukku vegna þess að heimskuleg (gráðug) kona (stelpa, barn) nær ekki að fá höndina út um þrönga opið. Hún hefur gert hnefa til að halda í innihald krukkunnar.
1290	1295	-	Sjöunda kakan seðjar	Sögur og brandarar (1200-1999)	1200-1349 Fíflasögur	Heimskur maður sér eftir því að hafa ekki borðað (drekkt) sjöundu kökuna (ýmsar aðrar tegundir af mat eða drykkjum) fyrst, þar sem það var sú sem veitti honum ánægju. Í sumum tilfellum er átið hluti af keppni.
1291	1295	A*	Hávaxinn brúðgumi kemst ekki inn í kirkju	Sögur og brandarar (1200-1999)	1200-1349 Fíflasögur	Mjög hár brúðgumi (brúður) kemst ekki inn um kirkjudyrnar (heimilis síns). Heimsku þjónar hans deila um hvort eigi að höggva af honum höfuðið eða rífa niður dyrnar. Ókunnugur maður slær hann á bakið og brúðguminn dettur niður. Nú getur hann gengið inn og ókunnugi maður fær verðlaun. Í sumum útgáfum kemst maður (kona) sem ríður á úlfalda (hesti) ekki inn um hlið. Dyrahliðin er brotin niður. (Ókunnugur maður ráðleggur honum að stíga af baki.)
1292	1296	-	Fíflaboð	Sögur og brandarar (1200-1999)	1200-1349 Fíflasögur	Fífl (lærlingur) er sendur út til að sækja ímyndaða hluti, t.d. vinstri handar skiptilykil eða lygapokann.
1293	1296	A	Fífl fara að kaupa gott veður	Sögur og brandarar (1200-1999)	1200-1349 Fíflasögur	(stormur, vor). Þau koma með humlu, (geitungu, fiðrildi, býflugusverm) í kassa (poka). Þau verða forvitin og opna kassann áður en þau komast heim. Góða veðrið flýgur burt.
1294	1296	B	Dúfur í bréfinu	Sögur og brandarar (1200-1999)	1200-1349 Fíflasögur	Heimskur maður á að taka tvær dúfur (krabba, ál, vínberjaklasa, piparkökur) í körfu til bónda ásamt skýringarbréfi. Á leiðinni sleppa dúfurnar (heimskinginn borðar matinn). Bóndinn les bréfið og spyr: „Hvar eru dúfurnar tvær sem eru í bréfinu?“ – „Þær sluppu úr körfunni. Það er heppni að þær eru enn í bréfinu.“ Í sumum útgáfum er þjónn (stúlka) sendur til að koma með körfu af ávöxtum ásamt bréfi. Á leiðinni borðar hann einn af ávöxtunum. Í bréfinu kemur fram hversu mikill ávöxtur var, svo viðtakandinn spyr þjóninn hvað varð um einn af bitunum. Hann svarar að hann hafi ekki verið í körfunni. Hann er sendur aftur í sama erindi daginn eftir. Hann felur bréfið áður en hann borðar ávöxtinn, því hann heldur að það geti fylgst með honum.
1295	1297	*	Að stökkva í ána á eftir félaga sínum	Sögur og brandarar (1200-1999)	1200-1349 Fíflasögur	Fífl (fífl) hoppa í á (sjó, brunn) til að komast yfir vatnið (ná ímynduðum kindum af botninum, fremja sjálfsmorð). Félagar fíflsins halda að hann vilji að þeir fylgi á eftir honum og stökkva allir í og drukkna. Í sumum afbrigðum lætur einhver annar fíflið hoppa.
1296	1305	-	Miser og gull hans	Sögur og brandarar (1200-1999)	1200-1349 Fíflasögur	Þessi saga birtist aðallega í fimm mismunandi myndum: (1) Í stað þess að biðja njátuga um laun sín biður verkamaður um að fá að sjá fjársjóð njátans. Þegar hann er spurður hvers vegna útskýrir hann að þetta muni veita honum sömu ánægju og það veitir njátanum. Sá síðarnefndi iðrast og dreifir auðæfum sínum meðal fátækra. (2) Njátuga, sem fjársjóður hefur verið stolinn, er ráðlagt að ímynda sér að hann sé enn ósnortinn; hann mun þannig njóta hans eins mikillar ánægju og áður. (3) Njátuga, sem vill taka gull sitt með sér í gröfina, skipar að það sé brætt svo að hann geti drukkið það. Brætt smjör er notað í staðinn og njátuga er blekktur. (4) Jafnvel í mikilli hættu eða á dánarbeði sínu hugsar njátuga um hvernig á að græða eða spara peninga. (5) Njátuga er rænt meðan hann liggur á sjúkrabeði sínu, eða fjársjóður hans finnst eftir dauða hans.
1297	1306	-	Snillingurinn neitar að rétta fram hönd sína	Sögur og brandarar (1200-1999)	1200-1349 Fíflasögur	Nerveri (klerkur, ölvaður maður) fellur í brunn. Menn flýta sér að bjarga honum (með reipi) og segja honum að rétta út höndina. Hann neitar. Vitur maður ráðleggur þeim að biðja ekki um hönd nerverunnar heldur að leggja til að hann taki í hendur þeirra. Maðurinn grípur í hendur þeirra og er bjargað.
1298	1309	-	Að velja hreinar fíkjur	Sögur og brandarar (1200-1999)	1200-1349 Fíflasögur	Af fíkjum (melónum) sem pissað hefur verið á, velur heimskur aðeins þær hreinu. Í prófraun etur hann þær allar.
1299	1310	-	Að drukkna krabbadýrið sem refsingu	Sögur og brandarar (1200-1999)	1200-1349 Fíflasögur	Þessi saga er aðallega til í þremur mismunandi myndum: (1) Lítið vatnadýr (t.d. skjaldbaka, krabbi, froskur) hefur eignast óvin, stórt landdýr (t.d. apa, ref, ljón, fíl) eða mann. Smádýrið, sem er dæmt til dauða, biður um að drukkna ekki. Því næst er því kastað í vatnið og sleppur. (2) Höfuðkúpur finna krabba. Vegna klóna hans rugla fíflarnir óþekkta dýrið saman við klæðskera og setja það á klút sem það á að klippa í sundur. Krabbin eyðileggur klútinn. Hann er dæmdur til að drukkna og er kastað í vatnið. Þegar dýrið syndir með erfiðismunum segir einn fíflanna: „Sjáðu hvernig það þjáist.“ (3) Höfuðkúpur setja út súrsaða síld í tjörnina sína og vonast til að fiskarnir fjölgi sér. Þegar fíflarnir tæma tjörnina finna þeir stóran ál sem þeir gruna að hafi étið síldina. Sem refsingu á að drukkna álinn.
1300	1310	*	Krabbinn er talinn vera djöfullinn	Sögur og brandarar (1200-1999)	1200-1349 Fíflasögur	Höfuðkúpur finna krabba (snigil). Þeir rugla óþekkta dýrinu saman við djöfulinn (landskrímsli).
1301	1310	A	Briar-Patch refsing fyrir kanínur	Sögur og brandarar (1200-1999)	1200-1349 Fíflasögur	Kanína (refur, sjakal) sem hefur stolið mat er gripin og á að fá refsingu. Hún þykist hrædd við að vera kastað í þyrnirunna og fær þannig fangara sinn til að gera einmitt það. Kanínan hleypur í burtu.
1302	1310	B	Að grafa moldvörpuna sem refsing	Sögur og brandarar (1200-1999)	1200-1349 Fíflasögur	Höfuðkúpur grípa moldvarpu sem hefur eyðilagt eng (tún, garð). Þeir íhuga hvernig þeir eigi að refsa óþekkta dýrinu og ákveða að jarða það lifandi. Moldvarpan sleppur.
1303	1310	C	Að kasta fuglinum af kletti sem refsingu	Sögur og brandarar (1200-1999)	1200-1349 Fíflasögur	Fugl (skordýr) sem á að fá refsingu fyrir óeðlilega hegðun (t.d. að stela korni eða stinga) þykist hræddur við að vera kastað í hyldýpi. Maðurinn (dýrið) sem veiddi fuglinn kastar honum niður af kletti (turni) og fuglinn flýgur burt.
1304	1311	-	Úlfurinn tekinn sem folald	Sögur og brandarar (1200-1999)	1200-1349 Fíflasögur	Úlfurinn er ruglaður saman við folald (hirðishundur, heppnin). Í fjarveru mannsins étur úlfurinn hryssu (hluta af hjarðinni, hest).
1305	1312	-	Björninn tekinn sem hundur	Sögur og brandarar (1200-1999)	1200-1349 Fíflasögur	Björn er ruglaður saman við hund. Í sumum afbrigðum er hundurinn ruglaður saman við björn (úlf) (og drepinn).
1306	1312	*	Að reyna að þvo svart dýr, hvítt	Sögur og brandarar (1200-1999)	1200-1349 Fíflasögur	Hænuþjófur reynir að þvo svarta hænu hvíta vegna þess að viðskiptavinur vill kaupa eina hvíta. Í sumum afbrigðum reyna hænuþjófar að þvo svart naut hvítt svo að það passi við hvítu kýrnar. (Þeir þvo eða mála eina nautið sitt til að þykjast eiga fleiri en eitt.)
1307	1313	-	Maðurinn sem vildi fremja sjálfsmorð	Sögur og brandarar (1200-1999)	1200-1349 Fíflasögur	Þessi saga birtist aðallega í tveimur mismunandi myndum: (1) Móðir (eiginkona) hefur sagt fífli að framkvæma ýmis verkefni. Hann mistekst og ákveður að drepa sig. Hann man eftir potti fullum af mat (drykk) sem móðir hans sagði að væri eitrað, borðar (drekkur) hann allan og leggst niður eins og hann sé dauður. (2) Meistari (prestur) segir lærlingi sínum (nýliða) að borða (drekka) ekki úr potti fullum af mat (drykk) sem hann segir að sé eitrað. Lærlingurinn hunsar viðvörunina og nartar í aðlaðandi matinn. Hann ver sig með því að þykjast vilja fremja sjálfsmorð.
1308	1313	A	Maðurinn tekur spádóminn um dauðann alvarlega	Sögur og brandarar (1200-1999)	1200-1349 Fíflasögur	Vegfarandi segir við fífl sem er að saga trjágreinina sem hann situr á að hann muni falla. Þegar fífillinn fellur telur hann að vegfarandinn sé spámaður og krefst þess að hann segi honum hvenær hann muni deyja. „Spámaðurinn“ segir honum að hann muni deyja (1) þegar asni hans (hestur) sleppir þrisvar sinnum í vindinn, (2) þegar hendur og fætur hans verða kaldir, (3) þegar rauður þráður eða þess háttar kemur frá líkama hans, (4) önnur tákn. Spádómurinn á sér stað og fífillinn heldur að hann sé dauður. Þegar kistuberar hans eða vegfarendur rífast um hvaða leið eigi að fara, sest fífillinn upp og ráðleggur þeim: „Þegar ég var á lífi fór ég þessa leið“.
1309	1313	A*	Í opnu gröfinni	Sögur og brandarar (1200-1999)	1200-1349 Fíflasögur	Drukkinn maður fellur í opna gröf og leggst til svefns. Þegar hann vaknar heldur hann að hann sé dauður. Í sumum útgáfum felur fífl sig fyrir hermönnum (ræningjum) í opinni gröf. Þegar þeir spyrja hann hvað hann sé að gera þar segir hann þeim að hann sé dauður. (Eftir að „dauði maðurinn“ er barinn af hermönnunum snýr hann heim til að vara vini sína við að forðast hermenn í hinum heiminum.)
1310	1313	B*	Kalda gröfin	Sögur og brandarar (1200-1999)	1200-1349 Fíflasögur	Drukkinn maður gengur um kirkjugarð að nóttu til og dettur í opna gröf. Einhver finnur hann þar (annar drukkinn maður dettur í sömu gröf) og fyrsti maðurinn kvartar yfir því hve kalt sé. „Engin furða,“ segir seinni maðurinn. „Þú ýttir af þér sænginni (jörðinni)“; eða „þú ert ekki með líkklæðið þitt“.
1311	1313	C*	Ekki enn dautt	Sögur og brandarar (1200-1999)	1200-1349 Fíflasögur	Læknir við rúmstokk veiks manns segir honum að hann sé nánast dauður. Sjúklingurinn heldur því fram að hann sé ekki dauður ennþá. Konan hans (einhver önnur) segir honum að þegja, læknirinn viti best.
1312	1314	-	Að rugla saman skaðlausum hlutum og hættulegum hlutum	Sögur og brandarar (1200-1999)	1200-1349 Fíflasögur	Fífl rugla smjörkrúsu saman við dauðan mann (djöfulinn). Þeir brjóta hana í tvennt. Í sumum afbrigðum rugla fífl stórt tré saman við snák (tréstofn saman við djöful eða björn, stór pylsa saman við dreka, poki fullur af tuskum saman við björn, o.s.frv.). Þeir reyna að drepa hættulega hlutinn með byssum eða spjótum.
1313	1315	*	Gufuskipið sem talið er vera djöfullinn	Sögur og brandarar (1200-1999)	1200-1349 Fíflasögur	Dumskulls rugla gufuskipi saman við djöfulinn. Í sumum afbrigðum ruglar ölvaður maður lest (reiðhjól) saman við djöfulinn, neitar að fara úr vegi hennar og slasast.
1314	1315	**	Hvít hryssa talin vera kirkja	Sögur og brandarar (1200-1999)	1200-1349 Fíflasögur	Skammsýnn maður (heimsk kona, dofnar konur sem hafa aldrei séð kirkju en hefur verið sagt að hún sé stór og hvít) ruglar hvítum hryssum saman við kirkju.
1315	1316	-	Að rugla saman einu dýri og öðru	Sögur og brandarar (1200-1999)	1200-1349 Fíflasögur	Þessi saga er aðallega til í fimm mismunandi myndum: (1) Heimskur bóndi sem hefur verið sendur út að sækja kýr (sauðfé) heldur að kanínurnar sem hlaupa á meðal þeirra séu hluti af hjörðinni. (2) Höfuðkúpur rugla ánamaðk saman við snák (skrímsli) eða frosk saman við lævirki (turtildúfu). (3) Höfuðkúpur (veiðimaður) rugla asna saman við kanínu vegna langra eyrna og drepa hann. (4) Heimskur ruglar mykjubjöllu saman við býflugu. (5) Storkar eru ruglaðir saman við kýr.
1316	1317	-	Blindu mennirnir og fíllinn	Sögur og brandarar (1200-1999)	1200-1349 Fíflasögur	Fjórir blindir menn þreifa á fæti, hala, eyra og líkama fíls og komast að þeirri niðurstöðu að fíllinn sé eins og trjábolur, reipi, vifta eða eitthvað án upphafs eða endis.
1317	1318	-	Að rugla saman manneskju (dýri, hlut) og yfirnáttúrulegri veru	Sögur og brandarar (1200-1999)	1200-1349 Fíflasögur	Auk þessarar almennu gerðar má greina þrjár sérstakar útgáfur: (1) Maður (dýr) sem felur sig í kirkju (kirkjugarði, líkbíl) er ruglaður saman við draug (dauði). (2) Heimskur ruglar yfirfullum peningum saman við draug. (3) Maður í draugahúsi skýtur af sér allar tærnar vegna þess að hann ruglar þeim saman við drauga.
1318	1319	-	Grasker selt sem asnaegg	Sögur og brandarar (1200-1999)	1200-1349 Fíflasögur	Höfuðkúpa finnur (kaupir) óþekktan ávöxt (grasker, melónu o.s.frv.). Hann ruglar honum saman við asnaegg (meri, úlfalda o.s.frv.). Þegar fíflið reynir að koma með „eggið“ heim dettur það niður og hræðir falda kanínu (kanínu, ref, mús). Fíflið heldur að flóttamaðurinn sé ungt dýr sem klekist út úr egginu. Hann eltir það eða reynir að laða það að sér.
1319	1319	*	Aðrar rangar auðkenni	Sögur og brandarar (1200-1999)	1200-1349 Fíflasögur	Ýmislegt. Ein manneskja (dýr, hlutur, ferli) er rugluð saman við aðra.
