idx	ATU	SUB	Classifications	Category	Subcategory	Variation Example
920	910	G	Maður kaupir sér snilld fyrir heila eyri	Raunverulegar sögur (850-999)	910-919 Góðar reglur	Ríkur maður á ástkonu þótt hann elski konu sína. Konan hans, í von um að breyta hegðun hans, biður hann um að færa henni vit í stað gjafar (gefur honum eyri til að kaupa vitið). Á markaðnum kaupir hann vitið í böggli sem inniheldur einnig nokkrar tötur. Seljandinn ráðleggur honum að klæðast tötrunum og kynna sig sem betlara fyrst fyrir ástkonu sinni og síðan fyrir konu sinni. Ástkona hans hafnar ástkonu sinni, sem virðist vera fátæk, en konan hans er tilbúin að hjálpa honum að greiða skuldir sínar. Hann er sannfærður um ást konu sinnar, játar sannleikann fyrir henni og ákveður að vera henni trúr. Konan er glöð að eiginmaður hennar sé loksins kominn til sjálfs sín.
921	910	K	Ganga að járnsmiðjunni	Raunverulegar sögur (850-999)	910-919 Góðar reglur	Deyjandi aðalsmaður, sem hafði þjónað lengi við konungshirðina, biður konunginn um að ráða son sinn. Konungurinn samþykkir og hinn deyjandi maður gefur syni sínum þrjár reglur. Í fyrsta lagi: „Eigið aldrei samneyti við öfundsjúka eða rógbera“ („Talið ekki um það sem þið hafið séð“ eða „Vínvið ekki hús húsbónda ykkar með hórdómi“). Í öðru lagi: „Synið alltaf samúð með örlögum og tilfinningum húsbónda ykkar“. Í þriðja lagi: „Farið aldrei fram hjá kirkju án þess að fara inn“ („Vanrækið aldrei að fara í messu“). Þegar faðir hans er látinn byrjar ungi maðurinn þjónustu sína við konungshirðina. Öfundsjúkur maður rógar hann og sakar hann um að girnast drottninguna. Þegar hann, að ráði föður síns, byrjar að gráta þegar drottningin grætur, er hegðun hans túlkuð sem sönnun á ástarsambandi og ákveðið er að hann verði drepinn. Andstæðingur hans (rógberi) ætlar að kasta honum í sprengiofn járnverksins (kalkofn, námugröf, brunn, brugghús, bökunarofn) eða drepa hann á annan hátt. Hann er sendur á staðinn þar sem hann á að vera drepinn. Þeim sem eru ákærðir fyrir morðið á honum er sagt að drepa fyrsta manninn sem kemur (hann hefur með sér skilaboð, bréf þar sem fyrirskipað er að hann verði drepinn eða ákveðinn hlut eins og vasaklút eða sítrónu). Samkvæmt ráðleggingum föður síns fer ungi maðurinn í messu á leiðinni og tefjist. Rógberinn (andstæðingur hans), óþolinmóður að sjá hann dauðan, kemur á staðinn á undan honum og er drepinn í hans stað. Saklausi ungi maðurinn skýrir síðan frá dauða rógberans. Hann fær aftur hylli eða öðlast auð, auð og heiður.
922	910	L	Ekki reka skordýrin burt	Raunverulegar sögur (850-999)	910-919 Góðar reglur	Þessi saga er aðallega til í þremur mismunandi myndum: (1) Refur sem fer yfir á lendir í sprungu og kemst ekki upp. Hann verður lúsasmitaður (flugur). Iðglingur sem gengur fram hjá sér refinn þjást og býðst til að hjálpa. Refurinn neitar og segir að þessar lúsir séu þegar fullar og ef ídgeltinn tekur þær burt muni nýjar lúsar sem eru enn svangari koma. (2) Veikur (særður) maður þakinn sárum er angraður af flugum. Hann neitar allri hjálp og segir að svangar flugur bíti tvöfalt fastar en fullar flugur. (3) Kaupmaður er tekinn höndum af ræningjum (bændur vilja refsa spilltum borgarstjóra eða þjófskum myllumanni, leigusali vill refsa einum af leigjendum sínum). Þeir afklæða hann (og hylja hann með hunangi) og binda hann við tré þar sem eru margar flugur. Maður (riddari) býðst til að reka skordýrin burt, en kaupmaðurinn neitar og segir að aðrar enn verri og svangari muni koma í þeirra stað. (Bændarnir létu bæjarstjórann [myllarann] lausan og ákveða að láta hann vera áfram í embætti sínu, svo að enginn enn ágjarnari myndi taka við af honum.)
923	910	M	Bænir fyrir harðstjórann	Raunverulegar sögur (850-999)	910-919 Góðar reglur	Gömul kona biður daglega fyrir heilsu hataðs harðstjóra. Aðspurð hvers vegna hún geri þetta útskýrir hún að hún hafi tvisvar séð hræðilegan harðstjóra deyja, aðeins til að vera skipt út fyrir annan enn verri. Þess vegna vonast hún til að sá núverandi lifi lengi.
924	910	N	Töfrakassi	Raunverulegar sögur (850-999)	910-919 Góðar reglur	Fátækur bóndi (húsmóðir) kvartar við nágranna sinn (prest) yfir því að býlið hans gangi ekki vel. Nágranninn gefur honum kassa sem hann segir vera töfra og segir bóndanum að bera hann einu sinni á dag í gegnum húsið sitt og fjósið. Þegar bóndinn gerir þetta tekur hann eftir vandamálunum og verður auðugur. Í annarri útgáfu segir eldri kona óhæfri húsmóður að hún ætti að leita um allt húsið sitt og garðinn að hvítum spörfugli. Þegar hún gerir þetta kemur húsmóðirin öllu í lag og verður auðug.
925	912	-	Vitri maðurinn og rigning heimskingjanna	Raunverulegar sögur (850-999)	910-919 Góðar reglur	Á ákveðnum rigningartíma verður hver sem vatnið fellur á fífl (þvingaður til að syngja og dansa). Vitur maður kemur og sér að allir fullorðnir og börn eru orðin brjáluð. Hann slæst í för með þeim í fíflsku þeirra. Hann spyr hvers vegna þau hegða sér svona og þau svara honum að það sé vegna rigningarinnar. Vitri maðurinn smakkar af regnvatninu og verður líka fífl. Í arabískum útgáfum heyrir stjórnandi að allir sem komust í snertingu við regnvatnið hafi orðið brjálaðir, svo hann drekkur það ekki. En þegar hann sér að hann hefur ekki lengur fyrra vald sitt og yfirráð, drekkur hann vatnið.
926	915	-	Allt fer eftir því hvernig þú tekur því	Raunverulegar sögur (850-999)	910-919 Góðar reglur	Ekkill sem á snjalla og duglega dóttur giftist ekkju sem á heimskulega og lata dóttur. Þegar börnin eru orðin fullorðin og tilbúin að flytja að heiman gefur móðir þeirra (faðirinn) þeim þrjár óbeint tjáðar reglur til að leiðbeina þeim í nýju sjálfstæði (atvinna, hjónaband). Í heimsókn áttar móðirin (foreldrarnir) sig á því að dóttir hennar hefur fylgt reglunum bókstaflega og því valdið sér miklum vandræðum. Stjúpdóttir hennar hins vegar skildi undirliggjandi merkingu reglunnar (oft með hjálp föður síns) og því gengur allt vel hjá henni.
927	915	A	Misskilin fyrirmæli	Raunverulegar sögur (850-999)	910-919 Góðar reglur	Deyjandi faðir (móðir) gefur syni sínum (dóttur) óbeint ráð (fyrir hjónaband): „Borðaðu alltaf brauð með hunangi“ (þýðir: „Vinndu ötullega og brauð þitt verður sætt eins og hunang“), „Guð blessi þig í erfiði þínu“ (þýðir: „Byrjaðu vinnu þína fyrr en aðrir, svo að aðrir heilsi þér þannig en þú ekki þeim“) og „Vertu alltaf í skónum þínum“ (þýðir: „Gakktu berfættur um akrana, notaðu aðeins skóna þína nálægt bænum“). Þegar sonurinn fylgir þessum boðorðum bókstaflega verður hann fátækur. Það er ekki fyrr en síðar sem hann lærir raunverulega merkingu þeirra. Eða faðirinn gefur kaldhæðnisleg boðorð: „Alltaf þegar þig langar til að spila fjárhættuspil, gerðu það þar til augun þín eru rauð og kinnar þínar eru fölar“, „Alltaf þegar þig langar til að drekka, gerðu það þar til þú ert ölvaður og sofnar“ og „Alltaf þegar þú girnist konu, farðu þangað snemma morguns og vektu hana“. Hann fylgir boðorðunum og spilar allan sinn pening. Hann drekkur til að gleyma tapinu og líður svo illa næsta morgun að hann vill aldrei drekka aftur. Hann heimsækir konu snemma morguns og er svo hræddur við útlit hennar að hann hleypur heim. Þar hugsar hann um „slæmu“ reglur föður síns sem læknuðu hann af fjárhættuspilum, drykkjuskap og kvennabósum.
928	916	-	Bræðurnir sem gæta svefnherbergis konungsins og snákurinn	Raunverulegar sögur (850-999)	910-919 Góðar reglur	Nokkrir bræður eru ráðnir af konungi til að gæta svefnherbergis síns. Sá fyrsti sér snák í svefnherberginu og drepur hann, en dropi af eitri hans fellur á drottninguna. Á meðan hann er að þurrka eitrið vaknar hún og ásakar hann um að reyna að ráðast á hana. Hinir bræðurnir segja sögur gegn því að taka fljótfærnislega ákvörðun. Næsta morgun kemur sannleikurinn í ljós. Sögurnar: (1) Saklausi hundurinn. (2) Trúfasti hundurinn sem trygging fyrir skuld. (3) Fálkinn og eitraða vatnið. (4) Páfagaukurinn og ávöxtur æskunnar. Páfagaukur færir konungi, húsbónda sínum, einhvern ávöxt æskunnar. Án þess að páfagaukurinn viti af því hefur snákur dropað eitri á ávöxtinn. Konungurinn gefur einn af ávöxtunum hundi sem deyr og drepur síðan páfagaukinn. Seinna kemur sannleikurinn í ljós.
929	920	-	Sonur konungsins og sonur smiðsins	Raunverulegar sögur (850-999)	920-929 Snjallar aðgerðir og orð	Þar sem ungi (ófæddur) sonur hennar kallar móður sína hóru, skipar drottningin að barnið (hinn ungi Salómon) skuli drepið. Barnið biður þjóninn um miskunn; hann er ekki drepinn heldur alinn upp af smið. Til þess að eiginmaður hennar uppgötvi ekki þessi svik, tekur drottningin son smiðsins sem sinn eigin. Á bernskuárunum leika drengirnir tveir sér við aðra. Í leik sínum sker Salómon sig úr vegna þess að í hlutverki konungsins sakfellir hann einn drengjanna sem svikara. Eða sonur smiðsins talar um landbúnaðarmál, en Salómon talar um hermál. Faðir hans, konungurinn (í eigin persónu eða í gegnum sendiboða), reynir visku drengsins með ómögulegum verkefnum eða erfiðum spurningum. Eða drengurinn (oft sem fjárhirðir) fellur viturlega dóma eða athuganir sem leiða í ljós konunglegan uppruna hans. Greind svör hans sýna að hann er sonur konungsins. Í sumum afbrigðum getur viðbótarþáttur fylgt í kjölfarið, en oftar er þetta sérstök saga: Kona Salómons strýkur með keppinaut konungi. Salómon fer að sækja hana. Hann er tekinn höndum en fær að blása í lúðurinn þrisvar sinnum áður en hann deyr. Þetta var fyrirfram ákveðið merki og her hans kemur og bjargar honum.
930	920	A	Málið með soðnum eggjum	Raunverulegar sögur (850-999)	920-929 Snjallar aðgerðir og orð	Móðir hennar skiptir á prinsessu sem barni við son bóndakonu í leyni, því konungurinn hefur hótað að drepa hana ef hún fæðir ekki dreng. Síðar þarf konungurinn að dæma í máli: Kaupmaður sem keypti fjörutíu egg fyrir ferð sína ætlar að greiða fyrir þau eftir heimkomu sína. En hann er beðinn um að greiða fyrir verðmæti allra kjúklinganna og afkvæma þeirra sem hefðu klekst út úr eggjunum. Konungurinn veit ekki hvernig á að dæma í málinu og heyrir fyrir tilviljun börnin sem skiptust á spila leik, málið um soðnu eggin. Prinsessan leikur hlutverk konungsins og bendir á að kjúklingar gætu aldrei klekst út úr soðnum eggjum. Konungurinn samþykkir ákvörðun stúlkunnar. Að lokum kemur í ljós hver börnin eru og þau eru skipt á ný.
931	920	A*	Forvitni konungurinn	Raunverulegar sögur (850-999)	920-929 Snjallar aðgerðir og orð	Salómon fullyrðir að allar konur geti verið tæltar (séu heimskari en karlar), jafnvel móðir hans. Hann sannar fullyrðingu sína með því að senda þjón til að tæla hana. Til að prófa hreinleika hennar dulbýr Salómon sig og fer í stað þjónsins að fundarstaðnum. Þegar móðir hans er að fara að fremja sifjaspell við sinn eigin son, áttar hún sig á blekkingunni og bölvar honum: Hann getur ekki dáið fyrr en hann hefur mælt hæð himinsins og dýpt sjávarins (áður en hann hefur farið umhverfis jörðina og niður á botn sjávarins). Þá reynir Salómon árangurslaust að mæla hæð himinsins og dýpt sjávarins. Á baki fugls flýgur hann til sólarinnar, en vængir fuglsins brenna og hann fellur niður (ernir taka hann upp til himins og láta hann falla niður, bölvunin verður sönn). Hann situr inni í kassa sem er festur við keðju og segir konu að láta hana síga niður á botn sjávarins. Því miður sker krabbi keðjuna. Í sumum afbrigðum tekst mæling hans. Á baki gamallar konu ríður hann til stjarnanna og djöflar bjarga honum úr sökkta kistunni.
932	920	B	Fuglar valdir af sonum konungsins	Raunverulegar sögur (850-999)	920-929 Snjallar aðgerðir og orð	Konungur spyr þrjá syni sína hvaða fugl þeir vildu helst vera. Sá fyrsti velur örn, því hann er stjórnandi fuglanna. Sá annar velur fálka, því hann er elskaður af aðalsmönnum. Sá þriðji segir að hann vilji vera fugl sem flýgur með mörgum öðrum, til að fá ráð. Konungurinn velur þriðja soninn sem næsta konung, því sem stjórnandi myndi hann alltaf leita ráða.
933	920	B*	Ætt þriggja sona konungsins	Raunverulegar sögur (850-999)	920-929 Snjallar aðgerðir og orð	Konungur, sem hefur verið hertekinn, spyr þrjá syni konungsins sem hefur tekið hann til fanga hvernig þeir muni koma fram við hann (hann gefur þeim gátur). Af svörum þeirra kemst hann að raun um uppruna þeirra. Annar sonanna er úr fjölskyldu böðla (bakara), hinn úr fjölskyldu kjötkaupmanna, en aðeins þriðji sonurinn er úr konungsfjölskyldunni.
934	920	C	Að skjóta á lík föðurins sem prófraun á faðerni	Raunverulegar sögur (850-999)	920-929 Snjallar aðgerðir og orð	Til að ákvarða hver er erfingi son sinn (hans eigin son) af þremur sonum sínum, krefst deyjandi konungur (ríkur maður) þess að hvor um sig skjóti á lík sitt. Sá yngsti neitar að skjóta (á hjarta sitt) og er því talinn eini sanni sonur hins látna föður síns; hinir tveir eru taldir óskilgetnir og eru arflausir.
935	920	C*	Val eiginkonu	Raunverulegar sögur (850-999)	920-929 Snjallar aðgerðir og orð	Ungur maður spyr Salómon (annar konung) ráða um hvers konar stúlku hann ætti að giftast: einni sem á eignir, einni sem á peninga eða fátækri sem á ekkert. Salómon svarar: „Farðu burt; þú veist ekkert; gerðu hvað sem þér sýnist.“ („Vertu þögull, ég ræður; stattu upp, svo ég geti sest niður; gerðu hvað sem þér sýnist.“). Svörin þýða því að fyrsta stúlkan myndi reka hann burt vegna þess að eignin tilheyrir henni; sú önnur myndi segja honum að peningarnir væru hennar og að hann væri fáfróður; en sú þriðja myndi ekki skipta sér af neinu, jafnvel þótt hún væri skapvond.
936	920	D	Fjórir prinsar	Raunverulegar sögur (850-999)	920-929 Snjallar aðgerðir og orð	Af fjórum sonum konungsins á sá sem getur nefnt flesta galla föður síns að verða næsti konungur. Yngsti sonurinn getur ekki nefnt einn einasta galla. Hann verður konungur.
937	920	E	Þrír hringir	Raunverulegar sögur (850-999)	920-929 Snjallar aðgerðir og orð	Deyjandi faðir gefur hverjum og einum af þremur (fleiri) sonum (börnum) sínum hring (stein). Aðeins einn hringurinn er ekta og hver sonur telur hann vera sinn. Spurningarnar um hvor hringurinn sé ekta og hvor sonurinn sé hinn sanni eru gerðar á grundvelli trúarbragða (kristinnar, gyðinglegrar, múslima- eða sértrúarlegrar) forsendna.
938	921	-	Konungurinn og sonur bóndans	Raunverulegar sögur (850-999)	920-929 Snjallar aðgerðir og orð	Drengur (sonur bónda, Salómon) fagnar konungi sem gengur fram hjá kofa hans með því að gefa snjöll svör. Svörin vísa til spurninga eins og: hvað gerir þú (faðir þinn, móðir, bróðir, systir)?. Og/eða þau fjalla um þversagnakennda kröfu um að koma til konungsins við ákveðnar aðstæður. Eftirfarandi spurningar og svör eru algengust: (1) Hvað ert þú að gera? Ég sjóða það sem kemur og fer (ég sjóða ertur, baunir og/eða linsubaunir sem halda áfram að rísa og falla í vatninu). (2) Hvað er faðir þinn að gera? Hann gerir slæmt verra (hann lokar slóð á akri sem veldur því að annar er troðinn niður). Eða hann er í víngarðinum að gera gott og slæmt (hann snyrtir vínvið en sker stundum góða og skilur eftir þá slæmu). Eða hann gerir margt úr fáum (hann sáir korni). (3) Hvað er móðir þín að gera? Hún gerir fyrir annan það sem sá síðarnefndi getur ekki gert fyrir sjálfan sig (hún leggur lík út). Eða hún er að baka gleymt brauð (til að borga lánað brauð). (4) Hvað er bróðir þinn að gera? Hann veiðir; hann hendir því sem hann veiðir, og það sem hann veiðir ekki ber hann heim (hann leitar að lúsum á líkama sínum). (5) Hvað er systir þín að gera? Hún syrgir hlátur síðasta árs (hún gefur barni sínu brjóst, ávöxt ástarsambands síðasta árs).
939	921	A	Deiling brauðs eða peninga	Raunverulegar sögur (850-999)	920-929 Snjallar aðgerðir og orð	Bóndi (handverksmaður) svarar spurningu konungs, hvers vegna hann vinni svona mikið eða hvernig hann myndi nota laun sín (fjóra peninga, brauð), með því að gefa dularfull svör: Fyrsta peninginn borða ég (fæði ég sjálfan mig), annan peninginn legg ég út með vöxtum (gef börnum mínum svo þau geti annast mig þegar ég verð gamall), með þriðja peningnum greiði ég skuldir (held foreldrum mínum) og fjórða peningnum hendi ég burt (gef konu minni). Konungurinn biður ráðherra sína að túlka svör bóndans fyrir sig. Þegar þeir spyrja bóndann krefst hann umbun fyrir hvert svar. Í miðaldaútgáfu er smiður að nafni Focus, sem vann á hátíðisdegi þrátt fyrir bann keisarans, svikinn af styttu sem galdramaðurinn Virgil reisti. Hann ver sig með því að segja að hann þurfi að vinna sér inn átta peninga daglega. Tvo af peningunum þarf hann að greiða til baka (föður sínum), tvo þarf hann að lána (syni sínum), tvo eru týndir (til að gefa konu sinni) og tvo eru til að eyða (fyrir sjálfan sig).
940	921	A*	Frank þjófurinn	Raunverulegar sögur (850-999)	920-929 Snjallar aðgerðir og orð	Konungur spyr fanga hvers vegna þeir hafi verið fangelsaðir. Allir segjast saklausir nema einn, sem játar að hann sé þjófur (falsari o.s.frv.). Hann er látinn laus svo að hann muni ekki spilla fyrir hinum.
941	921	B	Besti vinur, versti óvinur	Raunverulegar sögur (850-999)	920-929 Snjallar aðgerðir og orð	Meginþema sögunnar er eftirfarandi verkefni: Maður á að koma með besta vin sinn og versta óvin. Hann uppfyllir verkefnið með því að velja hund sinn sem vin og konu sína sem óvin. Sagan er aðallega til í þremur mismunandi myndum: (1) Þegar húsbóndinn skipar þjóni sínum (Aesop) að færa mat þeim sem elskar hann mest, þjónar þjónninn hundinum sínum í stað konu sinnar. Konan móðgast og hótar að yfirgefa eiginmann sinn. Þjónninn útskýrir að aðeins hundurinn myndi elska húsbónda sinn því hann myndi snúa aftur jafnvel þótt hann hefði verið barinn. (2) Ungur maður brýtur gegn skipuninni um að allir gamlir menn skuli drepnir. Hann felur föður sinn með hjálp konu sinnar. Vegna samsæris öfundsjúkra manna krefst konungurinn þess að ungi maðurinn, undir dauðadómi, komi með þjón sinn, vin sinn (fífl) og óvin sinn til konungsins. Að ráði föður síns tekur hann asna sinn sem þjón, hund sinn sem vin (barn sitt sem fífl) og konu sína sem óvin. Hin móðgaða eiginkona ávítar eiginmann sinn fyrir að flokka hana á þennan hátt eftir að hún hafði hjálpað honum að fela föður sinn. Þetta svik gerir hana að óvini hans og því tekst honum verkinu. (3) Ungur maður bjargar djöflinum (ókunnugum manni, dýrlingi, draugi, ræningja) frá úlfi (önnur hætta) og djöfullinn lofar að greiða fyrir þjónustuna ef ungi maðurinn kemur með sinn trúfasta vin á fundinn. Maðurinn kemur með konu sinni. Djöfullinn birtist í dýrðlegum dulargervi og sannfærir konuna um að drepa eiginmann sinn þegar hann sefur. Seinna lofar hann henni hjónabandi og auðæfum. Konan samþykkir. Þegar hún lyftir hnífnum (öxi, steini) fyrir morðið vekur djöfullinn eiginmann hennar. Hann segir að hann hafi nú endurgoldið manninum með því að bjarga lífi hans og neitar að greiða bætur. Maðurinn hefði átt að koma með hundinn sinn í stað konu sinnar. (Maðurinn verður að koma með sinn sanna vin daginn eftir. Hundur hans eltir hann án þess að vera kallaður á hann, ræðst á ókunnuga manninn og sannar trúfesti hans.)
942	921	B*	Betlari, þjófur, morðingi	Raunverulegar sögur (850-999)	920-929 Snjallar aðgerðir og orð	Aðalsmaður (keisari, prestur) fylgist með gömlum bónda plægja akur sinn af kappi. Aðspurður hvort hann eigi enga syni sem geti hjálpað honum svarar gamli maðurinn að hann eigi þrjá háskólamenntaða syni, einn sé þjófur (ræningi, lygari, kúgari), annar morðingi (kúgari, sígauni) og sá þriðji betlari (svikari, skúrkur). Aðalsmaðurinn byrjar að skilja þegar bóndinn útskýrir í smáatriðum að fyrsti sonur hans sé dómari, annar læknir (slátrari) og sá þriðji prestur (munkur, kennari).
943	921	C	Af hverju hárið á höfðinu er grátt áður en skeggið	Raunverulegar sögur (850-999)	920-929 Snjallar aðgerðir og orð	Maður (klerkur, rakari) svarar spurningunni hvers vegna hárið á höfði hans er grátt (hvítt) en skeggið svart: „Hárið á höfðinu er tuttugu árum eldra en skeggið“.
944	921	C*	Stjörnufræðingur og læknir í bóndahúsinu	Raunverulegar sögur (850-999)	920-929 Snjallar aðgerðir og orð	Bóndi spáir fyrir um veðrið út frá hegðun dýranna sinna (þegar flugurnar leita skjóls undir hala hestsins, þá kemur rigning) betur en stjörnufræðingurinn (heimspekingurinn), sem er gestur hans. Þar að auki veit bóndinn meira en læknirinn, sem er líka gestur hans, um val á hollum mat og útbreiðslu sjúkdóma.
945	921	D	Hið banvæna rúm	Raunverulegar sögur (850-999)	920-929 Snjallar aðgerðir og orð	Borgari spyr sjómann hvers vegna hann fari ítrekað á sjó þótt faðir hans og afi drukknuðu þar. Sjómaðurinn spyr hvernig forfeður borgarans dóu. Borgarbúinn svarar: „Í rúminu“, og þá spyr sjómaðurinn hvort borgarinn sé ekki hræddur við að fara að sofa?
946	921	D*	Snjöll svör	Raunverulegar sögur (850-999)	920-929 Snjallar aðgerðir og orð	Þessi tegund sögu inniheldur ýmsar sögur sem fjalla um mann sem reitir annan mann til reiði með því að gefa fáránleg svör. Húsbóndi (aðalsmaður, lögfræðingur) spyr bónda (verkstjóra) sem kemur heim af markaðnum hvort markaðurinn sé stór. Bóndinn svarar: „Ég mældi hann ekki!“ Húsbóndinn segir: „Nei, ég vildi vita hvort það væri troðfullt?“ Bóndinn segir: „Ég taldi ekki fólkið!“ Þá verður húsbóndinn reiður og ætlar að bjóða bóndanum í mat og síðan elta hundana sína á hann. Á leiðinni í matinn finnur bóndinn tvo héra. Þegar húsbóndinn sleppir hundunum sínum sleppir bóndinn hérunum svo að hundarnir elti þá. Húsbóndinn skipar þjóni sínum að bera fram vín fyrir bóndann í kjallaranum og síðan að berja hann. Þegar bóndinn tekur tappann úr tunnunni verður þjónninn að halda gatinu lokuðu og bóndinn ber hann. Seinna felur bóndinn beikonsneið undir skyrtunni sinni og beygir sig niður þegar hann gengur upp stigann. Þegar fólk spyr hann hvort hann hafi nóg svarar hann: „Nú hef ég nóg fyrir börnin mín og sjálfan mig til að sleikja í sex vikur!“ Þegar bóndinn er leiddur fyrir dóm fyrir að hafa barið þjóninn þykist hann vera fáviti og því er ekki hægt að dæma hann.
947	921	E	Aldrei heyrt áður	Raunverulegar sögur (850-999)	920-929 Snjallar aðgerðir og orð	Maður er skylt að segja eitthvað sem hvorki konungurinn né hirðmenn hans hafa nokkurn tímann heyrt áður. Maðurinn les bréf sem á að vera frá öðrum konungi þar sem krafist er endurgreiðslu á peningum sem þessi konungur hafði fengið að láni.
948	921	E*	Leirkerasmiðurinn	Raunverulegar sögur (850-999)	920-929 Snjallar aðgerðir og orð	Leirkerasmiður kemur konungi á óvart með snjöllum svörum sínum. Konungurinn skipar aðalsmönnum sínum að kaupa potta af honum. Leirkerasmiðurinn hækkar verðið. Einn aðalsmaður vill ekki borga og samþykkir, í staðinn fyrir greiðslu, að bera leirkerasmiðinn inn í höllina á herðum sér. Eða konungurinn leggur aðalsmönnum sínum gátu fyrir: Hvað er versta illska í heimi? Þeir vita ekki svarið. Aðeins leirkerasmiðurinn veit það. Hann sýnir lausnina með því að setjast á vagn sinn með pottunum og segir aðalsmanni (sem bað hann um lausnina) að draga hann að höllinni. Konungurinn skipar leirkerasmiðinn að aðalsmanni.
949	921	F	Heimspekingur spýtir í skegg konungsins	Raunverulegar sögur (850-999)	920-929 Snjallar aðgerðir og orð	Heimspekingur er boðið að borða með konungi. Á meðan máltíðinni stendur er hann neyddur til að spýta og gerir það í skegg konungsins. Þjónarnir reiðast og vilja berja hann, en konungurinn krefst þess að spyrja heimspekinginn hvers vegna hann gerði slíkt. Heimspekingurinn svarar að allt annað í kringum hann væri úr silki eða gulli, þannig að skegg konungsins væri besti staðurinn til að spýta. Konungurinn samþykkir þessa skýringu.
