idx	ATU	SUB	Classifications	Category	Subcategory	Variation Example
480	433	B	King Lindorm	Tales of Magic (300-749)	425-449 Husband	This tale deals with a brave woman who marries a snake (worm, frog or toad, lizard, another animal). She disenchants him by kissing or embracing him or by sharing his bed, or because she wears more shirts than he has layers of skin. This tale exists chiefly in three different forms: (1) A poor woman gives birth to a snake (a couple adopt a snake or a frog as their child). When the animal grows up he wants to marry the daughter of the king. The king sets impossible tasks, which the snake accomplishes (the snake frightens the king). The snake marries the princess, & after the wedding he turns into a handsome man (prince). (2) A childless queen (through a hasty wish or magic conception) gives birth to an animal son (snake, dragon, etc.) whom she keeps secret. When he grows up he wants to marry, but every woman who marries him is killed on her wedding night. One courageous young woman (a mistreated stepdaughter) puts on seven shirts one on top of the other (on the advice of a wise woman, her dead mother). She challenges the snake to shed one of his skins every time she takes off one of her shirts. When he is completely stripped, she whips him & then bathes him in milk. She lies down beside him & he turns into a handsome young man. (The skins are destroyed.) (3) A young woman marries a snake who gives her jewelry & turns into a handsome young man. The woman burns the snake skin & lives happily with her husband. Another jealous woman tells her father she too wants to marry a snake. She is left in a room alone with such an animal, who kills her. In some variants after the husband is disenchanted, the woman is (slandered by a jealous woman and) banished. She disenchants a prince (who has been transformed into a bird) or a dead man, marries him, & gives birth to a son. Her first husband finds her after a long search. She must choose between the husbands & decides to stay with the first
481	434	-	Stolen Jewelry	Tales of Magic (300-749)	425-449 Husband	(In order to avert a prophecy, a princess is confined to a tower or underground cave.) A prince in the form of a bird visits her three times & each time takes something away (jewelry, comb, mirror, hair ribbon). The princess becomes lovesick & goes to find the bird. She learns (from an old man) where the bird has gone & discovers that he can change into a handsome young man. She becomes pregnant by him and, in his mother’s house, gives birth to a child. She learns (from him) how she can disenchant him. She fulfills the requirements (together with his mother) & he is disenchanted.
482	434	*	The Diver	Tales of Magic (300-749)	425-449 Husband	A man skilled in diving lives like a fish in the sea (and sometimes transforms himself into an ocean animal). The king summons him & orders him to go & report on various places under the water. The diver complies at first, but then he refuses to go to a particularly dangerous place. The king throws his crown into the sea, sending the diver on a quest from which he never returns. In an Estonian oikotype, the diver is in love with a princess. A jealous suitor tells her to throw a piece of jewelry into the sea for the diver to retrieve. The diver transforms himself into a duck & accomplishes this task. He turns back into his human form & marries the princess
483	440	-	The Frog King or Iron Henry	Tales of Magic (300-749)	425-449 Husband	A young princess (youngest of three sisters) drops her golden ball into a well, & a frog gives it back to her. (In some variants the frog helps her with some other difficulty.) He makes her promise him that he may eat from her plate, drink from her cup, & sleep in her bed. The animal comes for his reward & the king insists the princess do as she had promised. Angry, she throws the frog at the wall & he turns into a handsome prince. In some variants the frog is disenchanted by means of a kiss, marriage, from being decapitated, etc. In the Grimms’ version: When the prince takes the princess home in his carriage, they meet his faithful servant Henry, whose heart had broken when the prince was enchanted. The iron bands that had held it together break from joy. In some variants the bride has the iron bands on her heart, & they break from pain, not from joy. After the disenchantment, both partners may be put to a test. The princess searches all over the world for her bridegroom, & he must identify his true bride.
484	441	-	Hans My Hedgehog	Tales of Magic (300-749)	425-449 Husband	A previously-childless couple (because of a hasty wish or a curse) have a son who is a hedgehog. He becomes a swineherd in the forest, where the pigs thrive under his care. He gives directions to three (two) kings (merchant, count, king, one king three times, etc.) who have lost their way, & is promised one of their three daughters as his wife. Riding on a rooster, he goes to claim his bride three times. Two of the princesses refuse him & he scratches them, but the third agrees to marry him. On the wedding night (on the way to the church, after they have lived together), the animal’s skin is destroyed (the princess kisses the hedgehog, whips him, cuts off his head, etc.). The hedgehog is disenchanted & turns into a handsome young man. (The two other princesses kill themselves from jealousy & anger.)
485	442	-	The Old Woman in the Forest	Tales of Magic (300-749)	425-449 Husband	Robbers attack a group of travelers, & a poor servant girl survives by hiding in a tree. In the evening a dove brings her keys that unlock three trees in which she finds food, clothing, & a bed. The dove tells her to go to a little house where she will find an old woman. She should not answer any of her questions but should bring back a plain ring, leaving the shiny one there. The girl does as the dove ordered, & does not let the old woman distract her. She stops the old woman from running away with a bird cage, & finds the ring in the bird’s beak. While waiting for the dove, the girl puts the ring on her finger. Immediately a tree envelops her with its branches & turns into a handsome young prince who explains that he had been en chanted by the witch. Other trees turn into servants & horses. The prince takes the girl to his kingdom, where they marry.
486	444	*	Enchanted Prince Disenchanted	Tales of Magic (300-749)	425-449 Husband	Misc. type. A prince is transformed (by a supernatural being) into an animal (monkey, fish, dragon, bird, cat, wild boar, etc.). He is disenchanted by a woman who sympathizes with him or helps him (by performing a task, obtaining a magic object, etc.)
487	449	-	Sidi Numan	Tales of Magic (300-749)	425-449 Husband	This tale exists chiefly in two different forms: (1) A man discovers that his wife eats corpses in the night. When he accuses her of this, she turns him into a dog. Another sorceress recognizes that the dog is really a human & returns him to his original form. With her help the husband is able to turn his wife into a mare & he beats her (to death). (2) An unfaithful wife turns her husband into a dog, which herds sheep & also rescues the king’s baby. When he returns to his wife, she turns him into a bird. He finds a magic wand, becomes a man again, & changes his wife & her lover into donkeys.
488	450	-	Little Brother & Little Sister	Tales of Magic (300-749)	450-459 Siblings	Little brother & little sister run away from their home because of their cruel stepmother or because their parents want to eat them. In spite his sister’s warning, the brother drinks from a spring or an animal’s track & is transformed into a deer (lamb, goat). The children live together in the forest until a prince finds them. The sister hides up in a tree but the prince tricks her into coming down. She marries the prince & they take the animal brother with them. The prince is absent when their child is born. The sister is replaced by another bride, often the daughter of a bad woman (stepmother, witch, maid). The sister is thrown into the water, transformed into a bird (fish), or swallow ed by a fish. She returns at night to suckle her child & to look after her brother. A servant overhears the conversation between the animal brother & the sister & informs the prince. The false bride & her mother are punished. In some variants the false bride & her mother want to kill the animal brother because they fear that the truth will be discovered. The cook saves him.
489	451	-	The Maiden who Seeks Her Brothers	Tales of Magic (300-749)	450-459 Siblings	A girl rescues her twelve (seven, three, six) brothers who had been transformed into animals (birds). This tale exists chiefly in three different forms but they are often mixed with each other: (1) A stepmother transforms her stepsons into swans (ravens). The sister looks for her brothers & finds out how to release them: She has to be silent for some years & has to make shirts out of cotton-grass for the brothers. A king finds the young woman in the forest & marries her. In his absence she bears a child, but her mother-in-law takes it away & accuses her of eating the child (having borne an animal). The young queen remains silent because of her brothers, even though she is to be executed. On her way to the funeral pyre her period of silence ends & her brothers are disenchanted. Everything is explained & the mother-in-law is punished.In some variants the disenchantment of one brother is not com-plete (he keeps a wing) because the sister cried a tear when her child was taken away (did not completely finish his shirt). (2) A girl finds her brothers in a remote place & keeps house for them. They tell her to take care of the cat (dog), watch the fire, & be careful of the demonic neighbor (ogre, witch). Once she forgets to divide her food with the cat, so it puts out the fire. After the girl asks the neighbor for help, the ogre comes regularly to suck her blood. When the brothers discover this, they kill him. The girl takes flowers (herbs) from the grave of the ogre. Her brothers eat them & they are changed into oxen (sheep, birds). The episode of disenchantment is less important. (3) A mother (father) curses her sons because there is not enough to eat. They are transformed into ravens (swans). The sister seeks for them & asks for directions from the sun, moon, & stars. She finds her brothers on a glass mountain (glass palace). To reach them she needs a little bone as a key (gets help from the wind). She releases her brothers & they go back home.In some variants the episode with marriage & slander fol-lows. Some variants start with the promise of the mother to sacrifice the brothers if a daughter (one more brother) is born. She tries to inform the boys after the birth by a sign, but the wrong sign is sent, so the brothers leave home.
490	452	B*	The Sisters as Oxen	Tales of Magic (300-749)	450-459 Siblings	A witch & her daughter are jealous of three beautiful orphan girls who are in the king’s favor. The witch puts magic powder in the girls’ soup & the two elder girls eat it & are transformed into oxen. The king asks the youngest girl to marry him & she accepts on condition that the oxen are cared for in the king’s palace. The witch visits the palace & sticks two pins in the queen’s head, so she becomes a dove. The witch’s daughter pretends to be the queen. The dove comes to the palace & is caught by a gar dener, who has heard it speak. The king removes the pins from its head & it regains human form. The witch & her daughter are burned to death.
491	459	-	The Make-Believe Son/Daughter	Tales of Magic (300-749)	450-459 Siblings	A king casts out his first wife because she is childless. Later a maidservant informs the king that this queen has born a son (daughter) but the king is not allowed to see it. The queen is supplied with a house & food. After some years the king arranges a marriage for his “child”. The maidservant makes an image of a youth or puts an animal in a sedan-chair. A god pities the queen & vivifies the image or turns the animal into a handsome youth (young woman). The king is rec-onciled with the queen.In some variants a prince falls in love with a doll thinking it is a young woman & he wants to marry her. Her “parents” convince him to marry the daughter of their neighbor.
492	460	A	Journey to God	Tales of Magic (300-749)	460-499 Supernatural Tasks	A beggar wants to know why he is so poor. Or, a man has heard that God returns alms given away a thousand times. This does not happen to him, so he goes to complain to God. On his journey to God (fortune, sun) the hero meets men, animals & objects that asks him (three) questions which he should ask God: e.g. (1) a wolf (lion) asks why he is never full after eating (answer: he has to eat a stupid person), (2) a tree asks why it is so dry (answer: a treasure is buried under the roots), (3) a king asks why he cannot enlarge his kingdom by war (answer: she is a queen & she should marry), (4) some young women ask why they are not married (answer: they throw the dirt into the sun), (5) a fish asks why he is alone in a river (answer: he should drown or devour somebody), (6) a river wants to know why there is no life in it (answer: it should drown somebody). God answers the questions & on the homeward journey the traveler passes on the answers & is rewarded. In some variants the traveler disclaims the rewards because God promised him wealth when he comes home. The wolf eats him up because the traveler is the most stupid person it ever met.
493	460	B	Journey in Search of Fortune	Tales of Magic (300-749)	460-499 Supernatural Tasks	Two brothers live together on their farm but only one of them does the work. This brother wants to divide the farm so he can run his part alone. He works harder than his brother but after a while he wonders why the farm of his lazy brother is more successful. He goes to find Fortune to ask her why. On his way he meets things & people that give him questions, & he promises to ask Fortune for answers. When he arrives at Fortune he is told that he was born on an unlucky day. He sees that Fortune from day to day has less to eat. When her servants tell her how many people are born on that day she orders that they should have as much as she had on that day. On the homeward journey, the man answers the questions of the things & people he has met. Sometimes he marries a lucky woman who brings him good luck. Later he gives someone who had asked him about the owner of the farm an untrue answer, & loses his luck.
494	461	-	Three Hairs from the Devil's Beard	Tales of Magic (300-749)	460-499 Supernatural Tasks	A poor young man wants to marry the daughter of a king (rich man). Her father tries to get rid of the young man by sending him to the devil (ogre) to bring him three hairs of the devil’s beard. On his way some objects & animals ask the young man to ask the devil some questions A well wants to know why it has dried up, a tree wants to know why it is withered & the ferryman who rows the hero to the devil wants to know when he will be replaced. With the help of the devil’s mother (grandmother, wife), who asks her son when she louses him or when he is asleep, the young man gets the three hairs & the answers to his questions. The ferryman has to give the oar to someone else, the spring of the well is blocked by a frog, & the roots of the tree are damaged by a treasure (snake). For his answers & help the young man receives a large reward, & the king has to accept him as son-in-law. The greedy king also wants to get treasures on the way to the devil, but he becomes the replacement for the ferryman.
495	462	-	The Outcast Queens & the Ogress Queen	Tales of Magic (300-749)	460-499 Supernatural Tasks	A king with three (seven, nine) wives has no children, but his wives become pregnant by eating a pear. When he is hunting he meets an ogress in form of a beautiful young woman whom he wants to marry. She demands that his wives shall be killed (thrown into a pit) & as proof she asks for their eyes (and their hearts). In the forest (a pit) the blinded outcast queens bear their children one after another, but because of their hunger they divide & eat them. Only the youngest queen saves her son. When the son grows up he takes care of the queens. The ogress queen recognizes him & tells him that he could get the eyes of the queens back if he does an errand for her. She gives him a Uriah letter & sends him to her mother. A helper changes the letter & the son is given the eyes, which he takes back to the queens. The king hears the truth & punishes the ogress queen.
496	465	-	Man Persecuted because of his Beautiful Wife	Tales of Magic (300-749)	460-499 Supernatural Tasks	A man marries a beautiful young woman of supernatural origin: She is an animal bride (e.g. swan maiden) or she comes from God. She secretly keeps house for him. He discovers her & steals or burns her animal skin to prevent her from turning back into an animal. An envious king coverts this beautiful wife and, on advice of an evil adviser (vizier, old woman), he gives the hero (three) impossible tasks to get rid of him: e.g. to build a castle or bridge in one night, to bring an exceptional baby (who understands 14 languages), to find a living harp, to harvest a field of grain in one night, to bring grapes in winter, to feed an army, to bring a huge tent that fits into one hand, to bring a very small (thumb-sized) man. The man accomplishes two of the tasks with the help of his wife. The last task often leads him to the otherworld, & it is accomplished by one of the wife’s relatives who defeats the king. In some variants the king finds out about the beautiful young woman from a picture that the hero carries with him.
497	467	-	The Quest for the Wonderful Flower/Jewel	Tales of Magic (300-749)	460-499 Supernatural Tasks	A young man finds a beautiful flower (jewel) & gives (sells) it to a king who demands more of them. The young man looks for the source & finds a prin-cess who produces the flowers (jewels) magically out of her blood. She had been kidnapped by an ogre, & the young man rescues her.
498	470	-	Friends in Life & Death	Tales of Magic (300-749)	460-499 Supernatural Tasks	Two friends promise each other to be guests at each other’s weddings. One of them dies but takes part invisibly in the wedding of the living friend. He invites him for a return visit. The living friend also takes part in the wedding of his friend in the otherworld. They take a long journey through the otherworld & see strange things: a broad & a narrow road to heaven & hell, fat cattle in a poor pasture & lean cattle in a green one (formerly rich & poor people), people & animals who argue, etc. When the living man returns he finds that he has been away many (three) centuries. All is changed & he knows no one. He dies or turns to dust.
499	470	A	The Offended Skull	Tales of Magic (300-749)	460-499 Supernatural Tasks	A drunken man finds a skull (statue, a dead man hanging on the gallows), kicks it, & invites it to dinner. The skull (dead person) visits the living person & warns him about his bad behavior (kills him). On a return visit, the living person is a guest in the otherworld. In some variants the living person watches things in the otherworld. In other variants the living person stays in the otherworld only for a short time, but finds that in this world a long time has passed & everything has changed.
500	470	B	Land Where No One Dies	Tales of Magic (300-749)	460-499 Supernatural Tasks	A young man seeks for a land where no one dies. On his way to the otherworld he meets animals & men who do things for which they need a very long time (e.g. to clear away a mountain grain by grain), but they are not immortal. Finally he reaches the land where no one dies & lives there together with a young woman. When he longs for his home, the woman advises him against leav-ing. He insists on going, & she warns him not to touch the earth. He passes the people & animals which he had met on outward journey, but they have finished their work & died. Back home he meets a man with a carriage full of worn-cut shoes, & he gets off his horse to help the man. But it is death looking for him, & he dies.
501	471	-	The Bridge to the Otherworld	Tales of Magic (300-749)	460-499 Supernatural Tasks	Three brothers one after the other set out to look for work, or to search for their lost sister who is married to someone in the otherworld. They are given a difficult job: They must herd seven foals (oxen) & at the end of the day they must bring back a sample of the animals’ food (other things).In some variants they have to accompany a supernatural being (sun, death) & are not allowed to talk or to be distracted. The elder brothers fail: They are lured away by a bird, or per-suaded by an old woman to rest, or they fail to cross a certain bridge. They are transformed to stone. The youngest brother follows the instructions & passes across the bridge. He sees visions: Fat cattle in a poor pasture & lean cattle in a green one, stones striking on each other, & animals which, passing in & out of a church, become human beings & take part in the Holy Communion. The boy takes bread & wine from the altar & brings it to the supernatural being. The visions are explained: the fat & lean cattle in the differend pastures fomerly were rich & poor people. The striking stones were people who argued & are forced to continue their conflicts in the otherworld. The animals in the church are angels, priests, or transformed princes. The youngest brother is rewarded & his brothers are disenchanted.
502	471	A	The Monk & the Bird	Tales of Magic (300-749)	460-499 Supernatural Tasks	A monk, thinking about the everlasting life in the monastery gardens, listens to the singing of a bird. He believes it lasts only a short moment but when he returns to the monastery he has grown old & nobody recognizes him because decades (three centuries) have gone by.
503	475	-	The Man as Heater of Hell's Kettle	Tales of Magic (300-749)	460-499 Supernatural Tasks	A poor soldier (servant) takes a job (for seven years) in hell. Or, parents wish that the devil will take their greedy child. The soldier has to heat the kettles & is not allowed to wash or comb himself. He is also not allowed to look into the pots. He breaks this rule & finds his former masters or unfriendly relatives in the kettles. He heats them even more. Or, he releases poor souls (transformed into animals). In payment he receives sweepings which later change into gold. Or, on the advice of a soul he has released, he asks for something worthless (an old piece of clothing) that gives money. The host at an inn where he stays for the night robs him of his gold, but with the devil’s help he recovers it.
504	476	-	Coal Turns into Gold	Tales of Magic (300-749)	460-499 Supernatural Tasks	This misc. type consists of various tales (mostly legends) in which coal turns into gold (silver). e.g.: (1) A person finds (the devil gives him) some coal that turns into gold. In some variants the person has to throw a rosary (bridle) onto the coal to effect the transformation. (2) A person breaks apart glowing coals & finds a treasure under them. (3) The gold (transformed coal) brings unexpected good fortune to a poor person (child, charcoal burner, maidservant, shepherd, orphan). (4) A maidservant gets glowing coals for her kitchen fire. The next morning, she finds pieces of gold in the ashes. Her master takes the gold away from her. (5) A man who wants to smoke his pipe has no lighter. He takes a piece of coal from the fire, but his pipe will not light from it even on the third try. When he knocks out his pipe, a piece of gold falls out of it.
505	476	*	In the Frog's House	Tales of Magic (300-749)	460-499 Supernatural Tasks	A woman promises a frog to be friends & becomes midwife (godmother) to the frog’s wife. She takes the frog’s child to be christened, sweeps the dust in the frog’s house, & takes the garbage home with her. There it becomes gold (money). In some variants she frees drowned souls or brings up the child of the frog for seven years & then is able to release its parents from enchantment.
506	476	**	Midwife in the Underworld	Tales of Magic (300-749)	460-499 Supernatural Tasks	Someone (an animal who turns into a supernatural being) summons a midwife to help a supernatural being (dwarf, water spirit, elf, forest spirit, human woman who has been kidnapped by fairies) give birth. As payment for her services, the midwife is given something apparently worthless (coal, leaves, garbage, onions, garlic), most of which she throws away carelessly. Later she finds that the small part she still has, has turned to gold. She looks for what she lost but cannot find it (the gift means danger of life).
