idx	ATU	SUB	Classifications	Category	Subcategory	Variation Example
1720	1567	E	The Hungry Man's Lies	Anecdotes & Jokes (1200-1999)	1525-1639 Clever Man	An apprentice tells lies about his stingy master (often in front of other people). The master gives the apprentice more food (rice, beans, eggs) in order to silence him. Thus the master loses his hoard.
1721	1567	F	Hungry Shepherd	Anecdotes & Jokes (1200-1999)	1525-1639 Clever Man	A hungry shepherd is not invited to eat by his master. He tells about a cow (goat) with four teats who bore five calves (kids). The people ask what the fifth calf does while the other four are nursing. The shepherd says, “It just watches as I am doing now”. He is then invited to join the meal.
1722	1567	G	Good Food Changes Song	Anecdotes & Jokes (1200-1999)	1525-1639 Clever Man	Workmen employed at a temporary job (threshing, mowing, woodworking) complain about their food in song (e.g. SO-O-OUP, SO-O-OUP, SO-O-OUP) & slow down their work. The next day, their master gives them better food. They change their song to reflect this (BREAD-MEAT-AND-PUDDING-TOO, BREAD-MEAT-AND-PUDDING-TOO) & work faster.
1723	1567	H	The Big & the Small Fish	Anecdotes & Jokes (1200-1999)	1525-1639 Clever Man	Two men buy fish from a fishmonger who has only one big & one small fish. At dinner, one of the men takes the big fish for himself, explaining to his partner that a good host would naturally take only the smaller portion.
1724	1568	*	The Master & the Farmhand at the Table	Anecdotes & Jokes (1200-1999)	1525-1639 Clever Man	A farmer & his farmhands help themselves to food out of a common dish. The farmwife always places the dish so that the best piece of meat lies near the farmer. Once the farmhand comes to the table early. No one is in the room, so he moves the dish to put the best serving near his own place. The farmer sees what he did, picks up the dish saying, “This dish once costed one thaler”, & moves it back to its customary position. Before he can stab the meat, the farmhand picks up the dish, says, “And it is still worth that today”, & moves the dish back near his own place. In some variants the farmer (clergyman) gets the best pieces (e.g. cracklings, butter) from the common dish by asking the other diners whether they know which way the sun (moon) rotates. He rotates the dish right or left to move the best part near himself. When the dish is in place, the farmhand says, “And then the thunderstorm begins”, stabbing his fist into the dish (stabbing the dish on the farmer’s head).
1725	1568	**	The Master & the Pupil Quarrel	Anecdotes & Jokes (1200-1999)	1525-1639 Clever Man	A stingy tailor sticks all the bits of meat together. When the meal is served, he takes the first helping, & all the meat lands on his plate. He announces, “What God has joined together, let no man put asunder”. The hungry apprentices plan revenge. They tell a customer that their master does good work but his temper is unpredictable: he often strikes the table with his fist & then falls in a rage. Before the tailor cuts the cloth, he hits the table to make the shears bounce so he can hear where they are & find them. The customer thinks the tailor is going to attack him & defends himself by grabbing the tailor around the neck & fighting. The tailor calls his apprentices to help, but they answer, “What God has joined together, let no man put asunder”.
1726	1569	**	Clothing the Servant	Anecdotes & Jokes (1200-1999)	1525-1639 Clever Man	A master agrees to clothe a servant (i.e. pro vide his clothing) at his expense. The servant insists that the condition be fulfilled literally, that the master dresses him.
1727	1570	*	"Gorge Silently"	Anecdotes & Jokes (1200-1999)	1525-1639 Clever Man	A soldier (guest), who is spending the night, eats up a whole dish of food. He asks the landlady (housewife) what this delicious food is called. She answers, “Gorge silently”. The soldier says, “Please give me some more of this gorge-silently”.
1728	1571	*	Servants Punish Their Master	Anecdotes & Jokes (1200-1999)	1525-1639 Clever Man	A master hides in order to watch his farmhands at their work. The farmhands discover him spying, make as if he is a thief, & beat him. He defends himself by saying that he is the master. They make as if he said something else & continue to beat him.
1729	1571	**	The Boastful Servant	Anecdotes & Jokes (1200-1999)	1525-1639 Clever Man	A servant boasts that he has scolded his master. But he does it secretly, so that the master does not hear.
1730	1572	*	The Master's Privilege	Anecdotes & Jokes (1200-1999)	1525-1639 Clever Man	A farmer asks his farmhand if he has any per sonal defects, & the farmhand replies that he sometimes gets into a rage (other description). The farmer says that his own defect is that he sometimes gets into a frenzy (etc.). The first time the farmhand man gets into a rage, he stays in bed (leaves his work), so the farmer gets into a frenzy & beats him. This cures the farmhand’s rage, & the master no longer gets into a frenzy either.
1731	1572	A*	The Saints Ate the Cream	Anecdotes & Jokes (1200-1999)	1525-1639 Clever Man	A clergyman sets a jug of sour cream (cream, milk, ham, honey) near a saint’s picture (in the pantry). When he is gone, the sexton (farmhand) steals (empties) it, smearing a little cream on the saint’s picture (statues). The clergyman believes that the icon stole the cream. He insults it & removes it from the church (the sexton hides it secretly, & the clergyman thinks it has run away). On the next holy day (the saint’s feast day), the clergyman asks the sexton (offers to pay him) to get a new icon. The sexton polishes the old icon & pretends that the saint has returned. The clergyman promises always to give the icon good food. The sexton thus eats well in the future.
1732	1572	B*	What God Gave Him	Anecdotes & Jokes (1200-1999)	1525-1639 Clever Man	A guest pulls all of the meat out of the soup & says, “What I caught, that is what God gave me”. After dinner the host pulls the guest by the hair & speaks the same words.
1733	1572	C*	"Don't Contradict Me!"	Anecdotes & Jokes (1200-1999)	1525-1639 Clever Man	A guest refuses something that his host has offered. Snapping, “Don’t contradict me!”, the host beats him. The guest replies, “Don’t tell me what to do!”, & strikes back. In some variants, the host beats one guest for contradicting him. Another guest eats everything that is offered to him, trades his poor clothes with the better ones of the host, & rides away on the host’s horse.
1734	1572	E*	The Clever Coachman & the Hungry Master	Anecdotes & Jokes (1200-1999)	1525-1639 Clever Man	While traveling, a master neglects to bring (order) food for his coachman. The coachman intentionally leaves his master behind in the forest.
1735	1572	F*	Turning the Shovel Backwards	Anecdotes & Jokes (1200-1999)	1525-1639 Clever Man	A farmhand dislikes large peas (beans), so he eats with his spoon upside down, saying, “If you stay on, I will eat you”. He gets married (his master sends him away) & has to provide for himself. Being in trouble, he asks his former master for a shovelful of uncooked peas. They go to the storeroom & the master turns the shovel upside down. He scoops the dry peas, saying, “If you stay on, I will measure you”.
1736	1572	K*	Not Many Words	Anecdotes & Jokes (1200-1999)	1525-1639 Clever Man	A master (woman) explains to his new farmhand that he does not like to use a lot of words. When he winks, the farmhand should come. The farmhand answers that that is fine with him, because he does not like to waste words either. When he shakes his head, that means he is not coming
1737	1572	L*	No Pay for Lying in the Sun	Anecdotes & Jokes (1200-1999)	1525-1639 Clever Man	Instead of working, a lazy farmhand lies down outdoors & sleeps. His master tells him that he does not deserve the sunshine that falls on him. The farmhand answers that he is lying in the shade (he will lie in the shade in the future).
1738	1572	M*	The Apprentice's Dream	Anecdotes & Jokes (1200-1999)	1525-1639 Clever Man	An apprentice tells his master that he dreamed he fell in a barrel of liquid manure & that the master fell into a barrel of honey. The master says that if this had happened the other way around, he would have punished him. Then the apprentice tells him the end of the dream: After they climbed out of the barrels, they had to lick each other clean.
1739	1572	N*	Cure for Constipation	Anecdotes & Jokes (1200-1999)	1525-1639 Clever Man	A master (king) complains to his servant (coach man) that he is constipated. In order to cure him, the servant takes the master for a drive. After a while, the master feels his bowels loosen & asks the servant to stop. The servant keeps on driving until the master cannot wait any longer. Then he stops the coach & lets him get down. This time, the master’s bowels open immediately.
1740	1573	*	The Clever Servant as Trouble Maker	Anecdotes & Jokes (1200-1999)	1525-1639 Clever Man	A servant creates great discord in his master’s household: he puts dough in his master’s bed & a newborn lamb in his daughters’, ties the dogs together, sticks a flute in the donkey’s backside, etc. The next morning, a fight breaks out over which of the parents relieved himself in bed, which of the daughters gave birth, etc.
1741	1574	-	The Tailor's Dream	Anecdotes & Jokes (1200-1999)	1525-1639 Clever Man	For many years, a tailor has stolen cloth from his customers. He dreams that on Judgment Day he has to answer to God by making a flag out of all the pieces of stolen cloth. After this dream, he swears not to steal any more, & asks one of his em-ployees to remind him of the dream if he ever lapses. For a long time, the tailor steals nothing. One day he is given some particularly fine material & plans to steal it. When the employee reminds him of his resolution, the tailor replies that this particular piece of material was not part of the flag.
1742	1574	*	The Foresightful Farmhand	Anecdotes & Jokes (1200-1999)	1525-1639 Clever Man	Whenever the master tells his farmhand what work should be done the following day, the farmhand says, “I already thought of that”. Finally the master dupes him by saying that tomorrow they must sow salt. The farmhand says that he had already thought of that.
1743	1574	A	The Stolen Piece of Cloth	Anecdotes & Jokes (1200-1999)	1525-1639 Clever Man	This tale exists chiefly in three different forms: (1) By mistake, a tailor sews a piece of cloth he has stolen on the outside of his coat, rather than on the inside. (2) A tailor takes advantage of an opportunity to cut a big piece of cloth. Then he realizes that he cut it out of his own coat Or, the tailor, who regularly takes part of his customers’ cloth for himself, cuts out some cloth for himself & lays a piece aside. When his wife asks what he is doing, he replies he did not want to get out of practice. (3) A stingy woman has the tailor come to her own house so that he will not be able to steal her cloth. The tailor cuts a piece & throws it out of the window, saying, “That is the devil’s piece”. While the woman runs outside to retrieve it, the tailor cuts another big piece of cloth for himself.
1744	1575	*	The Clever Shepherd	Anecdotes & Jokes (1200-1999)	1525-1639 Clever Man	A master refuses to pay back the money he has borrowed from his shepherd (the master makes his farmhand work too hard or gives him poor food). The shepherd hides up in a tree. When the master passes by, the shepherd calls out his name in a disguised voice & demands that the master pay (assign different work, give better food). The master believes that it is God speaking to him & does what the shepherd demands.
1745	1575	A*	God Speaks	Anecdotes & Jokes (1200-1999)	1525-1639 Clever Man	A man (clergyman) rides his bicycle (walks) along a road bordered by trees. One (more) of his neighbors hides behind a tree & calls out his name (calls, “Turn back!”). After this happens three times, the man thinks it is God who is speaking to him, & he answers, “Yes, Lord, I hear you”.
1746	1577	-	Blind Men Duped into Fighting	Anecdotes & Jokes (1200-1999)	1525-1639 Clever Man	A trickster (Eulenspiegel) says that he is giving one of several blind men some money which they all should share. However, he does not give any of them any money. Each suspects the others of cheating & they fight. The trickster watches from a safe distance. In some variants, the trickster takes them to an inn to drink but does not give any of them the money.
1747	1577	*	Blind Robber Paid Back	Anecdotes & Jokes (1200-1999)	1525-1639 Clever Man	A blind trickster steals from (does not return some money to) a harmless man. The injured man follows the blind man home & steals his whole hoard of money. Often he robs (tricks) several blind men.
1748	1577	**	The Blind Man Tricked	Anecdotes & Jokes (1200-1999)	1525-1639 Clever Man	A boy who works as a guide & servant to a stingy blind man is so hungry that he steals a sausage (pie) from him. The blind man smells that the boy has eaten the food & beats him. The boy takes revenge by pretending to help the blind man cross a pit. He leads the man near a post (tree), runs a few steps, & pretends to jump over the pit. The blind man copies him & jumps into the post. He falls & is injured. The boy comments, “If he could smell that I ate the sausage, he should have smelled that there was a post there”.
1749	1578	*	The Inventive Beggar	Anecdotes & Jokes (1200-1999)	1525-1639 Clever Man	A beggar gives a woman his knife to cut off a piece of bread for him & pretends that he used the knife before to dismember a dog. (Or, a Gypsy tells a bishop that he tasted food from the bishop’s dish.) The woman (bishop) is so appalled that she gives him the whole loaf (dish).
1750	1578	A*	The Drinking Cup	Anecdotes & Jokes (1200-1999)	1525-1639 Clever Man	A boy (girl, servant girl) offers a thirsty guest a glass (bowl) of water (milk, juice, wine). After he drinks, the boy tells him that a mouse had drowned in the water or that the bowl had been used as a chamber pot (dog’s dish).
1751	1578	B*	How a Woman Came to Loathe Tripe	Anecdotes & Jokes (1200-1999)	1525-1639 Clever Man	A woman develops an aver-sion to offal (tripe) after she sees the unappetizing manner of its preparation.
1752	1578	C*	The Apple	Anecdotes & Jokes (1200-1999)	1525-1639 Clever Man	A farmer (boy) brings two apples (pears) to his landlord. The landlord bites one himself & gives the other back to the farmer. The farmer takes out a knife to peel his apple, & the land lord asks why he does not eat the peel. The farmer tells him that one of the apples fell into a cowpat (manure) but he is not sure which one it was.
1753	1579	-	Carrying Wolf, Goat, & Cabbage across Stream	Anecdotes & Jokes (1200-1999)	1525-1639 Clever Man	A man has to cross a stream in a boat that will hold himself & only one other object. He needs to transport a wolf (lion, jackal), a goat (sheep), & a cabbage (bundle of hay, pumpkin). He must be sure that, when he is out in the boat, the wolf does not eat the goat & the goat does not eat the cabbage. There are two solutions. (1) He takes the goat across, then takes wolf across & brings goat back; he takes cabbage across, comes back, & takes the goat across last. (2) He takes the goat over, then takes the cabbage over & brings the goat back; he takes wolf over, & then takes goat over last.
1754	1579	**	A Hundred Animals	Anecdotes & Jokes (1200-1999)	1525-1639 Clever Man	A man (farmer) is driving a herd of pigs (sheep). Someone asks him where he is going with his hundred animals. He answers, “If I had this many again, & half, & a quarter, & one, then I would have a hundred animals”. Answer: He has 36 animals.
1755	1580	A*	Mounting the Horse	Anecdotes & Jokes (1200-1999)	1525-1639 Clever Man	A drunken traveler (clergyman) is unable to mount his horse. He calls on God, various saints, & the forty holy martyrs to help him. He then manages to get up onto the saddle, but falls over the other side. He concoles himself that he had too many helpers.
1756	1585	-	The Lawyer's Mad Client	Anecdotes & Jokes (1200-1999)	1525-1639 Clever Man	A farmer (in financial distress) sells the same animal (hog, cow, calf, hare) to several different people (has committed other misdemeanors) & is to stand trial. His lawyer ad-vises him to plead insanity, & to speak only in animal noises (barks, bleats) or always to answer in the same words (yes, aha, nothing, nonsense words). He is not convicted, & his lawyer demands his fee. The man uses the same trick & does not pay.
1757	1585	*	The Farmer's Promise	Anecdotes & Jokes (1200-1999)	1525-1639 Clever Man	A farmer consults a lawyer & promises to send him a rabbit as payment (is paid for a rabbit which he claims he sent to his master). When the lawyer (master) later asks where the rabbit is, the farmer answers that he sent it to him, but perhaps the animal did not know (forgot) the address.
1758	1586	-	The Man in Court for Killing a Fly	Anecdotes & Jokes (1200-1999)	1525-1639 Clever Man	This tale exists chiefly in two different forms: (1) A man (farmer, baker, fool) goes to court, accusing flies of stealing. The judge (mayor, czar) decrees that the man may kill whatever flies he can. A fly lands on the judge’s nose (cheek), & the complainant carries out the sentence. The judge is injured or killed, but no one can accuse the foolish fly-killer. (2) A fool (several fools) tries to kill (shoo away) a fly (several flies, bees, etc.) with an unsuitable instrument (ax, cannon, sword, gun, etc.). He accidentally kills the person whom the insect had been bothering. In some variants the killer is an (tame) animal (e.g. bear, monkey).
1759	1586	B	The Fine for Assault	Anecdotes & Jokes (1200-1999)	1525-1639 Clever Man	A man who hates the mayor (judge) asks him how much the fine would be if he hit someone (is required to pay a fine for having hit someone). He pays that amount (double) & hits the mayor.
