idx	ATU	SUB	Classifications	Category	Subcategory	Variation Example
507	480	-	The Kind & the Unkind Girls	Tales of Magic (300-749)	460-499 Supernatural Tasks	A girl is mistreated by her stepmother & has to work very hard. This tale exists chiefly in two different forms: (1) A girl loses an object which is carried off by a river (blown away by the wind), & runs after it (a spindle. She comes upon an old woman (ogress) who asks her to clean (disarrange) & to louse her head. When the old woman lets her choose a box as her reward, she chooses the plain one. (2) A girl falls into a well (is pushed in, jumps in after an object she has dropped), or follows a rolling cake (ball of yarn, etc.). She encounters various animals, objects, or people who ask her for help: e.g. a cow wants to be milked, an old man or woman to be loused or fed, an oven to be emptied of bread, an apple tree to be shaken. The girl helps them all. Then she arrives at the house of an old woman (Frau Holle, old man, supernatural beings like a giant or the twelve months) where she is assigned tasks: e.g. she has to do the household or farm work, has to feed or louse the demon, has to comb the hair of fairies, has to carry water in a sieve or wash black wool white. She is very helpful & hard-working. In the end she is is rewarded with gold, jewels, etc., becomes more beautiful, or jewels fall from her mouth. Or, she can choose her reward & is very modest but the reward changes into wealth when she reaches home.In some variants she is forbidden to enter a certain room. When she breaks this rule, she becomes covered with gold & flees. The grateful animals, objects, & people of her outward journey help her escape from the demon. After she arrives home, her envious stepmother sends her own daughter on the same journey. This girl goes through the same situ-ations but she refuses help, disobeys, & is unkind. She is punished severely (frogs fall from her mouth, horns grow on her head, or she is disfigured, beaten or killed). In some variants the stepmother is also punished. In the end the kind young woman often marries a prince.
508	480	A	Girl & Devil in a Strange House	Tales of Magic (300-749)	460-499 Supernatural Tasks	A girl leaves home because of her cruel stepmother. On her way she helps some animals & takes them with her. During the night they stay in a strange house. A demon (devil) tries to enter (to dance with the girl, to marry her), but the girl refuses to open the door unless he gives her certain valurable gifts. When morning comes, the demon has not fulfilled all the wishes so he cannot enter the house. He loses his strength & goes away. This is often followed by account of the unfriendly stepsister who gives no help to the animals & is killed by the demon.
509	480	A*	Three Sisters set out to Save their Little Brother	Tales of Magic (300-749)	460-499 Supernatural Tasks	A witch carries away the little brother of three sisters. The elder sisters set out to search him, but pay no attention to the requests of an apple tree, an oven, etc. , & are overtaken by the witch. The third does all she is asked to do; therefore, the grateful objects help her to recover her little brother from the clutches of the witch.
510	480	C*	Trasporting White Bread to Hell	Tales of Magic (300-749)	460-499 Supernatural Tasks	A poor brother brings his wealthy brother a gift of coarse white bread (a lamb). The wealthy brother says, “Go to hell with your bread”. On his way to hell, the poor brother meets an old man who tells him what he has to do there. He saves many souls from hell & is rewarded by the old man. The wealthy brother also takes bread to hell, but is discourteous to the old man & gets no advice. He falls victim to the devils.
511	480	D*	Tales of Kind & Unkind Girls	Tales of Magic (300-749)	460-499 Supernatural Tasks	This misc. type consists of various tales in which an unkind girl (neighbor, wife) wants to have the same re ward that a kind one received. However, she is too selfish & is punished instead.
512	485	-	Borma Jarizhka	Tales of Magic (300-749)	460-499 Supernatural Tasks	The tsar sends a man to Babylon to get a crown. He steals the crown & burns the snakes that pursue him. He comes to an one-eyed giant, blinds him, & escapes from the cave under the belly of the giant. He begets a child with a wild woman, but when he leaves her she is so angry that she breaks the baby in two. He helps a lion who brings him home. In spite of the lion’s warning, he boasts of his journey while he is drunk. In justification he shows the lion the power of intoxication, & gets him drunk.
513	485	B*	The Power of Drunkenness	Tales of Magic (300-749)	460-499 Supernatural Tasks	The animal helper (bear, lion) of a man forbids him, on pain of death, to praise him. The man breaks this rule while he is drunk. In order to justify & save himself, he makes the animal drunk. While it is drunk the animal lets itself be bound. It acknowledges the power of drunkenness & forgives the man.
514	500	-	Name of the Supernatural Helper	Tales of Magic (300-749)	500-559 Supernatural Helpers	(e.g. Tom Tit Tot, Rumpel-stilzchen, Trillevip.) A father (mother) boasts that his daughter can spin gold or impossible amounts of yarn. Or, a mother beats her daughter because she is lazy. The king asks why & the mother says she will not stop spinning. The young woman’s talent is to be tested & she is shut in a room to spin. If she fails she will die, but if she succeeds the king will marry her. She cries. A supernatural being (a little man) agrees to help her if she will promise him her first child (herself) if she cannot guess his name. In some variants she has to remember his name after a long time. The young woman passes the test & the king marries her. After a year the little man, certain that she could not guess his name, comes back to take her child away. By chance the name is discovered (by a servant, the husband or the woman herself) when the little man sings it triumphantly in the forest. When the woman says the correct name to the helper he vanishes or sinks into the earth.
515	500	*	The Monster Reveals the Riddle	Tales of Magic (300-749)	500-559 Supernatural Helpers	Students must count the peaks of a mountain range. They go to sleep. A monster watches them & thinks they are a multi-headed monster. He says that he walked through all the peaks of the mountain range (naming the number) & had never seen such a strange thing. Thus the students hear & solve the riddle.
516	501	-	The Three Old Spinning Women	Tales of Magic (300-749)	500-559 Supernatural Helpers	Through a false boast of her mother or of a young woman herself, she is compelled to spin an impossible amount of thread. If she is successful a prince will marry her. She receives help from three old women who are deformed from too much spinning: the first has an enormous foot, the second has drooping lips, & the third has a thick thumb. In payment she must invite them to her wedding. The prince sees them & exclaims in disgust. They tell him that their deformities come from spinning. He swears that he will never let his wife spin again.
517	502	-	The Wild Man	Tales of Magic (300-749)	500-559 Supernatural Helpers	A king catches a wild man (Iron John) & puts him into a cage, forbidding anyone to set him free. His son frees the pris-oner because his ball rolls into the cage or because he feels pity for him. The prince is afraid of his father’s anger & leaves home (his father drives him away to be killed or sends him to another king) along with a servant. On their way the servant persuades the prince to exchange clothes. The prince becomes a servant at the court of another king. At a tournament he appears unrecognized three times on a splendid horse which he received from the wild man & wins the hand of a princess. Or, he wins the princess because he has helped her father in war. Often the wild man is disenchanted. In some variants the prince works for a while at the wild man’s house where he disobeys instructions (e.g. looks into a forbidden chamber, cares for a horse although it is not allowed) & his hair turns to gold.
518	503	-	Gifts of the Little People	Tales of Magic (300-749)	500-559 Supernatural Helpers	A hunchbacked man takes part in a dance of the witches or people from below the earth (elves, fairies, dwarfs). He sings their song or adds a missing rhyme or more weekdays. As a reward they remove his hump or give him gold. A greedy neighbor (hunchbacked person) wants to get the same reward, but he ruins the song or is unfriendly. The little people add the hump of the other man to his own, or give him coals instead of gold.
519	505	-	The Grateful Dead	Tales of Magic (300-749)	500-559 Supernatural Helpers	One introductory episode is combined with various main parts in which a man wins a princess & a castle. The ending is also very similar. Introductory episode:While traveling, a man sees a corpse which is not allowed to be buried or is ill-treated by its creditors. He uses all his money to pay the debts of the dead man & for his funeral. Later he meets the grateful dead man in the form of a traveling companion (old man, servant) who wants to help him on the condition that they will divide all their winnings. Main parts: (1) The man ransoms a princess, who had been kidnapped, from slavery & marries her. While the man is away in another country, the father of the princess recognizes the sail of the ship which is emboidered with the princess’s coat of arms & learns that his daughter is alive. When the man goes back to fetch his wife, he finds that she has been abducted by one of her father’s courtiers. The man searches for his wife, & the traveling companion helps him to return to his father-in-law’s court. There the man discloses his identity as the husband of the princess & gets his bride back. (2) The man rescues a young woman from robbers. On their way home by ship the man is thrown overboard by a rival but is rescued by the traveling companion & brought to the prin-cess. He is recognized by means of a ring or otherwise. The rival is unmasked & punished. (506B.) (3) The traveling companion equips the man with a magnificent horse. A tournament takes place in which the winner is to marry a princess. The man wins her. (508.) Ending: The traveling companion asks for his part of the winnings & wants to divide the princess (their baby). When the man, trying to save the princess, offers the whole kingdom, the traveling companion reveals himself as the grateful dead man, says his de-mand was only a test of faith, & vanishes.In some variants the grateful dead man is a saint, who helps the hero because he has redeemed a saint’s picture that was mistreated.
